Title,Price,Link,Image Link,Sold Date
1951/52 Norwich City v Arsenal FA Cup 3rd Roumd at Carrow Road good condition,"199,812.26 VND",https://www.ebay.com/itm/205374961155,https://i.ebayimg.com/images/g/LBoAAOSwV2Rnxbar/s-l500.jpg,"Sold  Apr 6, 2025"
"Norwich City - Carrow Road - Ariel Photo - 6""x4""","133,096.98 VND",https://www.ebay.com/itm/324246281137,https://i.ebayimg.com/images/g/UhEAAOSwiVpfJACE/s-l140.jpg,"Sold  Mar 31, 2025"
Norwich City Colours Scarf Shape Badge Green & Yellow Canaries Carrow Road NCFC,"189,804.97 VND",https://www.ebay.com/itm/365202039732,https://i.ebayimg.com/images/g/RQUAAOSwildnIBPW/s-l140.jpg,"Sold  Mar 12, 2025"
Norwich (Carrow Road) Golf Driver Headcover,"1,033,753.26 VND",https://www.ebay.com/itm/235952939894,https://i.ebayimg.com/images/g/MTIAAOSwRS1nqprP/s-l140.jpg,"Sold  Mar 9, 2025"
Norwich City Shirt Mens Medium Yellow Green Jersey Carrow Road 80th Anniversary,"467,006.96 VND",https://www.ebay.com/itm/146400776406,https://i.ebayimg.com/images/g/fs4AAOSwgsNm4A~o/s-l140.jpg,"Sold  Feb 19, 2025"
Vintage Norwich City FC Large Football Pennant. The Canaries/Carrow Road.,"416,303.35 VND",https://www.ebay.com/itm/356509823616,https://i.ebayimg.com/images/g/AOsAAOSwCzZkEeHu/s-l140.jpg,"Sold  Feb 14, 2025"
Carrow Road Indoor City Street Sign Norwich,"867,298.64 VND",https://www.ebay.com/itm/115256361929,https://i.ebayimg.com/images/g/NgEAAOSwVUFiD3x~/s-l140.jpg,"Sold  Feb 12, 2025"
CARROW ROAD NORWICH CAR HANGING AIR FRESHENER VANILLA OR YLANG YLANG,"149,775.80 VND",https://www.ebay.com/itm/154494843262,https://i.ebayimg.com/images/g/VKMAAOSwJHlgyU40/s-l140.jpg,"Sold  Feb 7, 2025"
NORFOLK COUNTY F.A. CENTENARY SEASON - CARROW ROAD - UNADDRESSED - 10/10/80,"226,831.95 VND",https://www.ebay.com/itm/364187862663,https://i.ebayimg.com/images/g/zmIAAOSwZFtkF1P4/s-l140.jpg,"Sold  Feb 6, 2025"
Norwich City FC Carrow Road Stadium. 3D Construction Toy. New Inc Big Screen.,"1,234,232.68 VND",https://www.ebay.com/itm/267123807454,https://i.ebayimg.com/images/g/IT4AAOSw28hnhPuY/s-l140.jpg,"Sold  Jan 20, 2025"
Norwich City FC vintage scarf (never worn)  2011 ‘Carrow Road’ reversible,"433,315.74 VND",https://www.ebay.com/itm/135498504922,https://i.ebayimg.com/images/g/61oAAOSwpsFnfYFu/s-l140.jpg,"Sold  Jan 19, 2025"
