Title,Price,Link,Image Link,Sold Date
FULHAM Football Enamel Pin Badge SUPPORTERS CLUB CRAVEN COTTAGE bw,"266,527.54 VND",https://www.ebay.com/itm/167388058039,https://i.ebayimg.com/images/g/QZAAAOSwm6Jn2rOW/s-l140.jpg,"Sold  Mar 23, 2025"
FULHAM Football Enamel Pin Badge SUPPORTERS CLUB CRAVEN COTTAGE bwr,"266,527.54 VND",https://www.ebay.com/itm/167383679985,https://i.ebayimg.com/images/g/cswAAOSwlcJn2CXW/s-l140.jpg,"Sold  Mar 17, 2025"
FULHAM Football Enamel Pin Badge SUPPORTERS CLUB CRAVEN COTTAGE wrb,"266,527.54 VND",https://www.ebay.com/itm/405623506039,https://i.ebayimg.com/images/g/QOAAAOSwbHhnzIHu/s-l140.jpg,"Sold  Mar 9, 2025"
FULHAM Football Enamel Pin Badge SUPPORTERS CLUB CRAVEN COTTAGE dbwpb,"266,527.54 VND",https://www.ebay.com/itm/405559434215,https://i.ebayimg.com/images/g/c6cAAOSwNlJntLFL/s-l140.jpg,"Sold  Feb 24, 2025"
FULHAM FC Craven Cottage Premium Cotton Slub T-Shirt - Navy - 1863FC,"780,339.80 VND",https://www.ebay.com/itm/365366561569,https://i.ebayimg.com/images/g/-YEAAOSwpB5mFGkt/s-l500.jpg,"Sold  Apr 5, 2025"
Columbia Craven Cottage vs USA Football Soccer Supporters Scarf 2014 November,"364,019.80 VND",https://www.ebay.com/itm/135187493087,https://i.ebayimg.com/images/g/geYAAOSwdRFl-dxL/s-l140.jpg,"Sold  Jan 24, 2025"
100 x Fulham Ultra Stickers based on Programme Scarf Pin Badge Craven Cottage,"500,031.02 VND",https://www.ebay.com/itm/135639386225,https://i.ebayimg.com/images/g/RbsAAOSwZOdn3HYt/s-l140.jpg,"Sold  Apr 9, 2025"
FULHAM FOOTBALL CLUB - CRAVEN COTTAGE METAL PIN BADGE,"166,454.62 VND",https://www.ebay.com/itm/396332645610,https://i.ebayimg.com/images/g/fSMAAOSwrXtn2c-g/s-l140.jpg,"Sold  Mar 31, 2025"
Fulham FC Keep The Faith Pin Badge Craven Cottage,"199,812.26 VND",https://www.ebay.com/itm/266773727416,https://i.ebayimg.com/images/g/hlkAAOSwE~pmICNs/s-l140.jpg,"Sold  Mar 30, 2025"
Official FULHAM FC Metal Stadium Street SIGN Craven Cottage SW6 40cm x 18cm,"374,939.87 VND",https://www.ebay.com/itm/265523975827,https://i.ebayimg.com/images/g/tSEAAOSwUK5h9VAk/s-l140.jpg,"Sold  Mar 28, 2025"
RARE OLD FULHAM F.C. CRAVEN COTTAGE ROUND CREST  ENAMEL PIN BADGE,"133,096.98 VND",https://www.ebay.com/itm/156661387467,https://i.ebayimg.com/images/g/nQUAAOSwUPRnipfm/s-l140.jpg,"Sold  Mar 26, 2025"
FULHAM F.C. Craven Cottage Map Prints & Frames | Poster Picture Art Decor Gift,"399,958.10 VND to 1,167,183.82 VND",https://www.ebay.com/itm/256115930973,https://i.ebayimg.com/images/g/7BQAAOSwUyZj9yr5/s-l140.jpg,"Sold  Mar 24, 2025"
Original Press Photo 1973 - Pele (Brazil) - Fulham v Santos at Craven Cottage,"700,510.44 VND",https://www.ebay.com/itm/187046090219,https://i.ebayimg.com/images/g/Mh8AAOSwOeFn1Duz/s-l140.jpg,"Sold  Mar 23, 2025"
Fulham FC Craven Cottage FFC Joe Bryan Print Football Art Poster Play-offs 2020,"433,315.74 VND to 1,233,899.10 VND",https://www.ebay.com/itm/124286177674,https://i.ebayimg.com/images/g/e9QAAOSwnPtggXN6/s-l140.jpg,"Sold  Mar 12, 2025"
Fulham FC BRXLZ 3D Construction Craven Cottage Stadium Official Product - NEW,"1,667,548.42 VND",https://www.ebay.com/itm/126979948615,https://i.ebayimg.com/images/g/uVoAAeSwkHhnythx/s-l140.jpg,"Sold  Mar 11, 2025"
Fulham v Port Vale  1986/87 Craven Cottage Football Programme 28/03/1987,"133,096.98 VND",https://www.ebay.com/itm/365439000940,https://i.ebayimg.com/images/g/IbYAAOSwoLhnxwzu/s-l140.jpg,"Sold  Mar 11, 2025"
Fulham Football Paperweight Craven Cottage With Old Logo,"833,607.42 VND",https://www.ebay.com/itm/335824303807,https://i.ebayimg.com/images/g/VQ4AAeSweX1nuIz~/s-l140.jpg,"Sold  Mar 7, 2025"
Craven Cottage - Home Of Fulham Football Club - Framed A4 Picture,"425,643.49 VND",https://www.ebay.com/itm/176720979477,https://i.ebayimg.com/images/g/flMAAOSwS2BnUgI1/s-l140.jpg,"Sold  Feb 25, 2025"
Fulham 2000 Craven Cottage Stevenage Road Plaque Stone Supporters,"1,667,548.42 VND",https://www.ebay.com/itm/335825733042,https://i.ebayimg.com/images/g/t5YAAeSw2iNnuaNh/s-l140.jpg,"Sold  Feb 22, 2025"
2020-21 Panini Prizm Craven Cottage Fulham Home Stadium Siver Case Hit SSP,"254,735.80 VND",https://www.ebay.com/itm/365382949736,https://i.ebayimg.com/images/g/n0AAAOSwublnpXM8/s-l140.jpg,"Sold  Feb 16, 2025"
"Vintage 'The Storm' by Frank Brangwyn Etching print - Craven Cottage, Fulham","199,812.26 VND",https://www.ebay.com/itm/205265701695,https://i.ebayimg.com/images/g/ByYAAOSwTbFnoelj/s-l140.jpg,"Sold  Feb 11, 2025"
FULHAM v TOTTENHAM CRAVEN COTTAGE 1948,"266,861.12 VND",https://www.ebay.com/itm/116189388169,https://i.ebayimg.com/images/g/~10AAOSw7ZFl8AqQ/s-l140.jpg,"Sold  Feb 9, 2025"
"Fulham Football Club Framed Print, Craven Cottage Stadium, Memorabilia Gifts FC","532,721.51 VND to 1,420,034.73 VND",https://www.ebay.com/itm/335041929066,https://i.ebayimg.com/images/g/opAAAOSwed5lDxRk/s-l140.jpg,"Sold  Feb 2, 2025"
Fulham FC Football Club NEW Craven Cottage Stadium Fridge Magnet Merchandise ,"166,454.62 VND",https://www.ebay.com/itm/315672753839,https://i.ebayimg.com/images/g/zaUAAOSwxE9hqONz/s-l140.jpg,"Sold  Jan 26, 2025"
Fulham FC Street Sign Craven Cottage Official NEW & SEALED UK STOCK,"398,623.80 VND",https://www.ebay.com/itm/295286440773,https://i.ebayimg.com/images/g/xGgAAOSwomVjT94c/s-l140.jpg,"Sold  Jan 17, 2025"
