Title,Price,Link,Image Link,Sold Date
Topps Match Attax Bundesliga 09/10 2009/2010 Dante Limited Edition LE3,"28,250.05 VND",https://www.ebay.com/itm/396381681213,https://i.ebayimg.com/images/g/lcYAAOSwLL5nzem-/s-l140.jpg,"Sold  Apr 6, 2025"
Topps Match Attax Bundesliga 2009/2010 09/10 - Dante Limited Edition LE3,"28,250.05 VND",https://www.ebay.com/itm/395698614415,https://i.ebayimg.com/images/g/BTEAAOSw-2tm6qPn/s-l140.jpg,"Sold  Mar 7, 2025"
TOPPS Dante Mönchengladbach Bundesliga 2010/11 Match Attax Trading Card,"38,985.06 VND",https://www.ebay.com/itm/314566850087,https://i.ebayimg.com/images/g/c48AAOSwCQZkUWuz/s-l140.jpg,"Sold  Mar 19, 2025"
Topps Match Attax Bundesliga 10/11 2010/2011 Dante Matchwinner 378,"28,250.05 VND",https://www.ebay.com/itm/396258554076,https://i.ebayimg.com/images/g/3BAAAOSwtyZnwdB1/s-l140.jpg,"Sold  Mar 7, 2025"
Borussia Mönchengladbach Match Attax - Topps - 2011/12 Bundesliga - Ter Stegen - Dante,"28,250.05 VND",https://www.ebay.com/itm/187002767541,https://i.ebayimg.com/images/g/J0EAAOSwbCFjMtfu/s-l140.jpg,"Sold  Mar 5, 2025"
Adrenalyn XL Champions League 12/13 - 47 Panini - Dante,"28,250.05 VND",https://www.ebay.com/itm/302383235065,https://i.ebayimg.com/images/g/TR8AAOSw~8FfrhTb/s-l140.jpg,"Sold  Feb 15, 2025"
DANTE VANZEIR 2023 Topps Finest Road To UEFA Euro 2024 Auto Signature,"25,527.15 VND",https://www.ebay.com/itm/226666022691,https://i.ebayimg.com/images/g/iScAAOSwXFVn4~jf/s-l140.jpg,"Sold  Apr 2, 2025"
