Title,Price,Link,Image Link,Sold Date
"Vtg 18"" African Fali Phallic Fertility Doll Namji Cameroon w Glass Trade Beads","767,590.00 VND",https://www.ebay.com/itm/116162304265,https://i.ebayimg.com/images/g/U0MAAOSwFklmLU0A/s-l500.jpg,"Sold  Feb 16, 2025"
African Guiziga Fali North Cameroon Wrought Iron Coin # 173 g3,"1,709,072.99 VND",https://www.ebay.com/itm/140543331617,https://i.ebayimg.com/images/g/lS0AAOxyLm9TBHGG/s-l140.jpg,"Sold  Apr 4, 2025"
ANTIQUE AFRICAN FALI CAMEROON BOUND IRON LEATHER BEADED FETISH FIGURE SCULPTURE,"7,338,680.80 VND",https://www.ebay.com/itm/196991467866,https://i.ebayimg.com/images/g/nt8AAOSw6~Znl5ct/s-l140.jpg,"Sold  Mar 20, 2025"
Amaltas Phali Amaltas fali Cassia Fistula Cassia Fistula Pods Herbs Whole,"362,979.00 VND to 2,132,339.00 VND",https://www.ebay.com/itm/275862492491,https://i.ebayimg.com/images/g/JtkAAOSwXGdkabA~/s-l140.jpg,"Sold  Mar 19, 2025"
Nkuku Fali Tumbler - Olive - (Set of 4) RRP £35,"666,819.22 VND",https://www.ebay.com/itm/235908073541,https://i.ebayimg.com/images/g/3s8AAOSwXLxmRPu0/s-l140.jpg,"Sold  Jan 14, 2025"
Babool Phali Powder (200 grams) - Babool Fali - Kikar Phali - Kikar Fali,"444,942.00 VND",https://www.ebay.com/itm/375555140580,https://i.ebayimg.com/images/g/suEAAOSwyLtmDU0U/s-l140.jpg,"Sold  Jan 15, 2025"
"1 Green Wine Glass, Rustic Chunky Teal Coloured Glassware,  Fali Nkuku, Ethical","400,291.68 VND",https://www.ebay.com/itm/174234462968,https://i.ebayimg.com/images/g/XVgAAOSwp2hed7LS/s-l140.jpg,"Sold  Jan 12, 2025"
FALİM PLAIN SUGAR FREE TOOTH FRIENDLY SINGLE GUM 100 PCS in 1 Box UK STOCK,"196,576.16 VND",https://www.ebay.com/itm/395164657873,https://i.ebayimg.com/images/g/reUAAOSwlupltVK6/s-l140.jpg,"Sold  Dec 24, 2024"
