Title,Price,Link,Image Link,Sold Date
"New Yellowstone National Park Geyser Large Cotton Tea Towel 33"" x 22.5""","442,079.80 VND",https://www.ebay.com/itm/256402937250,https://i.ebayimg.com/images/g/PPcAAOSwDEZlwa7V/s-l140.jpg,"Sold  Apr 9, 2025"
PopSockets PopTop (Top only. Base Sold Separately.): Swappable Top Nylon Geyser,"207,899.80 VND",https://www.ebay.com/itm/265519374619,https://i.ebayimg.com/images/g/9WIAAOSwgWph8V~D/s-l140.jpg,"Sold  Apr 9, 2025"
Mana Geyser NM Rainbow Foil 1821 MTG Secret Lair Drop Unplayed Magic Gathering ,"181,879.80 VND",https://www.ebay.com/itm/156840936910,https://i.ebayimg.com/images/g/-YUAAeSwKm9n6YLa/s-l140.jpg,"Sold  Apr 8, 2025"
MTG 1x Mana Geyser Fifth Dawn Pauper Modern Magic the Gathering Card x1 NM,"78,060.00 VND",https://www.ebay.com/itm/405619037184,https://i.ebayimg.com/images/g/W2IAAOSwWtdnyy0R/s-l140.jpg,"Sold  Apr 8, 2025"
VTG Old Faithful 3D Geyser Yellowstone Park Sterling Silver Charm Pendant - 2.9g,"572,440.00 VND",https://www.ebay.com/itm/405655600223,https://i.ebayimg.com/images/g/jAUAAeSwBXxn1Io6/s-l140.jpg,"Sold  Apr 8, 2025"
YELLOWSTONE National Park FAIR GEYSER & FIREHOLE RIVER 1912 Postcard,"129,839.80 VND",https://www.ebay.com/itm/235779162238,https://i.ebayimg.com/images/g/HU4AAOSw7Xpm~aiG/s-l140.jpg,"Sold  Apr 8, 2025"
US #4059 MNH 2006 Superlative Wonders Steamboat Tallest Geyser,"65,570.40 VND",https://www.ebay.com/itm/234792414302,https://i.ebayimg.com/images/g/9t0AAOSwyARjfmDT/s-l140.jpg,"Sold  Apr 8, 2025"
Columbia Baby Fire Side Sherpa Full Zip Geyser ice blue 6-12 months,"520,400.00 VND",https://www.ebay.com/itm/156843189990,https://i.ebayimg.com/images/g/q5cAAeSwJW9n6t6L/s-l140.jpg,"Sold  Apr 8, 2025"
"2006 39c Wonders of America, Steamboat, Geyser, Yellowstone Scott 4059 Mint NH","43,713.60 VND",https://www.ebay.com/itm/204502464720,https://i.ebayimg.com/images/g/nJQAAOSwQxBlLLn3/s-l140.jpg,"Sold  Apr 8, 2025"
"STAMP US SCOTT 4059 ""Wonders-Steamboat, Tallest Geyser"" 39 CENT 2006 MNH","51,779.80 VND",https://www.ebay.com/itm/155465268435,https://i.ebayimg.com/images/g/ZIUAAOSwp-lkGj2R/s-l140.jpg,"Sold  Apr 8, 2025"
Seismograph Pool Yellowstone National Park West Thumb Geyser Basin Postcard,"118,130.80 VND",https://www.ebay.com/itm/205005445295,https://i.ebayimg.com/images/g/XUkAAOSwtHxm7zn8/s-l140.jpg,"Sold  Apr 8, 2025"
"Old Faithful Geyser Yellowstone Colored Photo Antique Or Vintage Frame 13"" x 18""","1,925,480.00 VND",https://www.ebay.com/itm/256715118501,https://i.ebayimg.com/images/g/AIIAAOSwSMJnNWyA/s-l140.jpg,"Sold  Apr 8, 2025"
"Postcard NORRIS GEYSER BASIN, YELLOWSTONE NATIONAL PARK   I97","129,579.60 VND",https://www.ebay.com/itm/316101842103,https://i.ebayimg.com/images/g/QR0AAOSwB-JndzZL/s-l140.jpg,"Sold  Apr 8, 2025"
Parks Project Yellowstone Geysers Trail Fleece Green/Beige Pullover Size MEDIUM ,"1,873,179.80 VND",https://www.ebay.com/itm/135658421493,https://i.ebayimg.com/images/g/qbwAAeSwEbJn6BGo/s-l140.jpg,"Sold  Apr 8, 2025"
"Crystal Geyser Spring Water, 0.5 Liters, Pack Of 24 Bottles","468,099.80 VND",https://www.ebay.com/itm/186943625183,https://i.ebayimg.com/images/g/97wAAeSw6Mpnqh5O/s-l140.jpg,"Sold  Feb 12, 2025"
Yellowstone National Park World's Oldest Bison Old Faithful Geyser Pin (P94),"676,259.80 VND",https://www.ebay.com/itm/176991185809,https://i.ebayimg.com/images/g/VfoAAeSwkMRn9IQG/s-l140.jpg,"Sold  Apr 7, 2025"
Grain Belt Beer (geyser) 13” Serving Tray,"325,250.00 VND",https://www.ebay.com/itm/256877388470,https://i.ebayimg.com/images/g/IbYAAeSwG-Fn6teZ/s-l140.jpg,"Sold  Apr 7, 2025"
Castle Geyser Yellowstone Park Detroit Photographic Undivided Postcard,"206,859.00 VND",https://www.ebay.com/itm/326378265654,https://i.ebayimg.com/images/g/6uYAAOSw0kBnW5-9/s-l140.jpg,"Sold  Apr 7, 2025"
"NM Mana Geyser, MTG, Tarkir Dragonstorm, Magic the Gathering, 223","75,978.40 VND",https://www.ebay.com/itm/167429676091,https://i.ebayimg.com/images/g/ym0AAOSwwXZn8LuI/s-l140.jpg,"Sold  Apr 7, 2025"
The North Face Boys - XXL (18/20) Long Sleeve Sun Shirt UPF40+ Geyser Aqua -NWT,"676,259.80 VND",https://www.ebay.com/itm/356488433393,https://i.ebayimg.com/images/g/Ul0AAOSwC-hnjs0C/s-l140.jpg,"Sold  Feb 17, 2025"
Mana Geyser (Rainbow Foil) [Secret Lair Drop Series] Foil Near Mint,"130,100.00 VND",https://www.ebay.com/itm/267191625200,https://i.ebayimg.com/images/g/DloAAOSw-8ln15NL/s-l140.jpg,"Sold  Apr 6, 2025"
*BRAND NEW-IN BOX* Unused Nyle Systems (Geyser-R) Water Heat Pump,"18,214,000.00 VND",https://www.ebay.com/itm/146125027351,https://i.ebayimg.com/images/g/tHMAAOSwUyxnGmk3/s-l140.jpg,"Sold  Apr 6, 2025"
Kenner Sky Commanders Commander RJ Scott Geyser Attack action figure 80s rare,"355,433.20 VND",https://www.ebay.com/itm/176968415612,https://i.ebayimg.com/images/g/VU0AAeSwT8Bn5Dsc/s-l140.jpg,"Sold  Apr 6, 2025"
"ROTORUA, NZ ~ WHAKAREWAREWA & GEYSER HOTEL, MUIR & MOODIE ~ c 1903","279,715.00 VND",https://www.ebay.com/itm/306210677356,https://i.ebayimg.com/images/g/L6EAAOSwbipn6auE/s-l140.jpg,"Sold  Apr 6, 2025"
MTG 108 Fifth Dawn Card Only Mixed Lot. Good Mix As Shown. Dawn2 Mana Geyser,"126,091.88 VND",https://www.ebay.com/itm/267204905267,https://i.ebayimg.com/images/g/90QAAeSwkTtnwaVg/s-l140.jpg,"Sold  Apr 6, 2025"
Algeria Alger Une rue de la Haute Ville  GEYSER phot,"52,040.00 VND",https://www.ebay.com/itm/286440941615,https://i.ebayimg.com/images/g/z3MAAOSwR35n5PD7/s-l140.jpg,"Sold  Apr 5, 2025"
"Dakine Classic Hip Pack Waist Pack, Geyser Grey","566,195.20 VND",https://www.ebay.com/itm/266339390237,https://i.ebayimg.com/images/g/dEMAAOSwrcZktrQH/s-l140.jpg,"Sold  Apr 5, 2025"
Columbia Toddler Girls Fire Side Sherpa Full Zip Geyser 3T,"702,540.00 VND",https://www.ebay.com/itm/226537409782,https://i.ebayimg.com/images/g/NeQAAOSwJuZngUX0/s-l140.jpg,"Sold  Apr 5, 2025"
MTG Magic the Gathering Mana Geyser (147/219) Conspiracy LP,"102,779.00 VND",https://www.ebay.com/itm/404625567968,https://i.ebayimg.com/images/g/vpoAAOSwCyRlVNtf/s-l140.jpg,"Sold  Apr 5, 2025"
Antique Blob Top Bottle Geyser Springs Soda,"1,014,780.00 VND",https://www.ebay.com/itm/205386149250,https://i.ebayimg.com/images/g/K44AAeSw9ipn6G3g/s-l140.jpg,"Sold  Apr 5, 2025"
LOT/9 YELLOWSTONE NP Original 1907 Photos GEYSERS TENTS NATURAL BRIDGE  Wyoming,"533,410.00 VND",https://www.ebay.com/itm/236030928122,https://i.ebayimg.com/images/g/NJsAAeSwJjhn6xLX/s-l140.jpg,"Sold  Apr 5, 2025"
Fair Geyser and Firehole River Yellowstone National Park Postcard,"99,656.60 VND",https://www.ebay.com/itm/146471923388,https://i.ebayimg.com/images/g/N8cAAOSw48xnntTY/s-l140.jpg,"Sold  Apr 4, 2025"
Postcard Firehole River Walkway Through Upper Geyser Basin West Yellow Stone,"130,100.00 VND",https://www.ebay.com/itm/196962133169,https://i.ebayimg.com/images/g/ZvAAAOSwmRdnfaoL/s-l140.jpg,"Sold  Apr 4, 2025"
Takara Tomy Tactical Mover Gale Versalter Ravager Unit Stella Geyser,"2,602,000.00 VND",https://www.ebay.com/itm/176761203799,https://i.ebayimg.com/images/g/4RMAAOSwCNNnb1wy/s-l140.jpg,"Sold  Feb 5, 2025"
MTG - 4 x Mana Geyser - Playset 4x x4 - Conspiracy Regular NM,"154,819.00 VND",https://www.ebay.com/itm/156841339646,https://i.ebayimg.com/images/g/KsEAAOSwm9hn6csl/s-l140.jpg,"Sold  Apr 4, 2025"
MTG Mana Geyser (Rainbow Foil) (1821b/2290) Secret Lair Drop Series NM FOIL,"180,839.00 VND",https://www.ebay.com/itm/127027947948,https://i.ebayimg.com/images/g/ugMAAeSwH7Fn7IR8/s-l140.jpg,"Sold  Apr 4, 2025"
"NWT Columbia Youth Girls Nordic Strider Jacket, Geyser Heather-Size XS","1,194,318.00 VND",https://www.ebay.com/itm/316402820233,https://i.ebayimg.com/images/g/QsEAAeSwp7xnwNhT/s-l140.jpg,"Sold  Apr 4, 2025"
"Ansel Adams - Castle Geyser Cove Yellowstone Park 1941 - 17""x22"" Fine Art Print","2,081,339.80 VND",https://www.ebay.com/itm/234049129934,https://i.ebayimg.com/images/g/oLwAAOSwSYBgxDjl/s-l140.jpg,"Sold  Oct 22, 2024"
1905 Old Faithful Yellowstone National Park Geyser Wyoming WY Vintage Postcard,"519,099.00 VND",https://www.ebay.com/itm/356736617804,https://i.ebayimg.com/images/g/qfMAAOSw2gJn7xHc/s-l140.jpg,"Sold  Apr 3, 2025"
NWT XCVI Wearable Pant Geyser Crop Orion Women NEW Ruched Gorpcore Core,"1,561,200.00 VND",https://www.ebay.com/itm/235905694117,https://i.ebayimg.com/images/g/PC4AAOSw2ednEpZL/s-l140.jpg,"Sold  Feb 27, 2025"
1988 Postcard Buffalo Taking a Steam Bath on Old Faith Geyser L. Drake Robinson,"84,565.00 VND",https://www.ebay.com/itm/166974098362,https://i.ebayimg.com/images/g/R2QAAOSwjJlm52E1/s-l140.jpg,"Sold  Apr 3, 2025"
Dakine Soho Wallet - Geyser Grey - New Coin Bag Money Bag Wallet NWT,"390,039.80 VND",https://www.ebay.com/itm/135463109578,https://i.ebayimg.com/images/g/5EsAAOSwjdJnazFO/s-l140.jpg,"Sold  Apr 3, 2025"
US USA Sc # 1453 MNH FVF Pl # Yellowstone National Park Old Faithful Geyser,"36,466.30 VND",https://www.ebay.com/itm/195918034977,https://i.ebayimg.com/images/g/Z~IAAMXQCtlRW0PU/s-l140.jpg,"Sold  Apr 3, 2025"
Tropicfeel Geyser Litli HDry Men’s US Size 9.5 Island Sand Travel Waterproof,"1,483,140.00 VND",https://www.ebay.com/itm/405610192445,https://i.ebayimg.com/images/g/2sQAAOSwyt1nyNIK/s-l140.jpg,"Sold  Apr 2, 2025"
Size 9.5 - Nike Air Max Tailwind 4 SP Geyser Grey,"1,691,300.00 VND",https://www.ebay.com/itm/167146514973,https://i.ebayimg.com/images/g/XlEAAOSwf6tnTn3E/s-l140.jpg,"Sold  Apr 2, 2025"
"Yellowstone National park Wyoming, geysers, embroidered patch, sew on style","259,939.80 VND",https://www.ebay.com/itm/234698262260,https://i.ebayimg.com/images/g/QbMAAOSwn8djG87R/s-l140.jpg,"Sold  Apr 2, 2025"
Mud Geyser Yellowstone National Park YNP WY 1952 Nature Water Photo Snapshot,"180,839.00 VND",https://www.ebay.com/itm/267171606414,https://i.ebayimg.com/images/g/YvcAAOSwDzhnvgQG/s-l140.jpg,"Sold  Apr 2, 2025"
Geysers Hot Springs Yellowstone National Park YNP 1952 WY Photo Snapshot #2,"128,799.00 VND",https://www.ebay.com/itm/267171606448,https://i.ebayimg.com/images/g/woMAAOSw24FnvwMb/s-l140.jpg,"Sold  Apr 2, 2025"
1948 Yellowstone National Park JEY GEYSER Sign Mound Vintage Photo Snapshot,"232,879.00 VND",https://www.ebay.com/itm/256878292643,https://i.ebayimg.com/images/g/cmAAAOSwuMtn68ug/s-l140.jpg,"Sold  Apr 2, 2025"
Yellowstone National Park Little Whirligig Geyser Sign Vintage Photo Snapshot,"232,879.00 VND",https://www.ebay.com/itm/267206825470,https://i.ebayimg.com/images/g/pDoAAOSw~eVn68wU/s-l140.jpg,"Sold  Apr 2, 2025"
MTG | Mana Geyser [Conspiracy] Near Mint,"94,459.63 VND",https://www.ebay.com/itm/286369451346,https://i.ebayimg.com/images/g/EFQAAeSwQBZnwajL/s-l140.jpg,"Sold  Mar 29, 2025"
INK GEYSER 119/204 Rare Disney Lorcana NON FOIL Archazias,"66,381.70 VND",https://www.ebay.com/itm/236030032480,https://i.ebayimg.com/images/g/TfwAAOSwqmNn6jlm/s-l140.jpg,"Sold  Apr 1, 2025"
UGG Women's Tasman X Clogs Waterproof Shoes 1125730 Sawdust Stormy Seas Geyser,"1,430,839.80 VND",https://www.ebay.com/itm/126273391720,https://i.ebayimg.com/images/g/vqIAAOSwpa1lwWro/s-l140.jpg,"Sold  Apr 1, 2025"
New Zealand 1967-70 Pohutu Geyser $2 Mint MNH SC 403,"50,739.00 VND",https://www.ebay.com/itm/186664184810,https://i.ebayimg.com/images/g/M8gAAOSwB49m1AZV/s-l140.jpg,"Sold  Sep 14, 2024"
SILVER DOLLAR CITY GEYSER GULCH GRANDFATHERED TUMBLER MUG STASH BOTTOM $1 REFILL,"1,039,499.00 VND",https://www.ebay.com/itm/226672274837,https://i.ebayimg.com/images/g/Bz0AAOSwtipn6It5/s-l140.jpg,"Sold  Mar 31, 2025"
MTG Fifth Dawn Mana Geyser x 4 Never Played!,"64,789.80 VND",https://www.ebay.com/itm/354012684235,https://i.ebayimg.com/images/g/enoAAOSwsptiWvKH/s-l140.jpg,"Sold  Mar 31, 2025"
Vintage Wyoming Postcard YELLOWSTONE Old Faithful Geyser 1949 to Clarence MO,"207,899.80 VND",https://www.ebay.com/itm/186847178888,https://i.ebayimg.com/images/g/iH8AAOSwz9hnYbWS/s-l140.jpg,"Sold  Mar 31, 2025"
Vintage Postcard Old Faithful Geyser Yellowstone National Park Thermal Features,"147,793.60 VND",https://www.ebay.com/itm/396313424750,https://i.ebayimg.com/images/g/r8kAAOSw8FFnjreo/s-l140.jpg,"Sold  Mar 31, 2025"
Postcard Yellowstone -  Old Faithful Geyser,"103,819.80 VND",https://www.ebay.com/itm/256844004178,https://i.ebayimg.com/images/g/ZD8AAeSwDOZnyDMr/s-l140.jpg,"Sold  Mar 31, 2025"
"Yellowstone National Park, Bison & Geyser Wyoming, 1st NP 1872 - Modern Postcard","51,779.80 VND",https://www.ebay.com/itm/405228462852,https://i.ebayimg.com/images/g/77kAAOSwxtZm5RSd/s-l140.jpg,"Sold  Mar 31, 2025"
Matala GM-4700 1/3HP Geyser Max Flow 4700gph Pond & Waterfall Pump - Submersible,"10,017,700.00 VND",https://www.ebay.com/itm/330687740304,https://i.ebayimg.com/images/g/G9AAAOSw5cNYgM6n/s-l140.jpg,"Sold  Mar 31, 2025"
Chauvet Geyser RGB JR LED Light & Fog Machine,"1,209,930.00 VND",https://www.ebay.com/itm/276960864554,https://i.ebayimg.com/images/g/7AYAAOSwgjxk5RIA/s-l140.jpg,"Sold  Mar 30, 2025"
Yellowstone National Park Keychain Key Fob Wyoming Souvenir Old Faithful Geyser,"362,979.00 VND",https://www.ebay.com/itm/364852462190,https://i.ebayimg.com/images/g/CeUAAOSwn-5mJBfw/s-l140.jpg,"Sold  Mar 30, 2025"
Sorcery Contested Realm Alpha FOIL Exceptional - Geyser,"338,520.20 VND",https://www.ebay.com/itm/187071898340,https://i.ebayimg.com/images/g/uBkAAeSwOcpn4D-O/s-l140.jpg,"Sold  Mar 30, 2025"
MTG Geyser Drake (51/441) Outlaws of Thunder Junction LP FOIL,"25,759.80 VND",https://www.ebay.com/itm/404980849076,https://i.ebayimg.com/images/g/hlYAAOSw00RmRgXD/s-l140.jpg,"Sold  Mar 30, 2025"
RETIRED! OIL FIELD ‘GEYSER GULCH’ - BRANSON MISSOURI ZINC PENNY,"102,779.00 VND",https://www.ebay.com/itm/135412910120,https://i.ebayimg.com/images/g/iq0AAOSwGPxnS9Hg/s-l140.jpg,"Sold  Mar 30, 2025"
"RPPC, At the Geysers, Sonoma County, California","234,180.00 VND",https://www.ebay.com/itm/286437261137,https://i.ebayimg.com/images/g/ojsAAOSwC8ln4wSY/s-l140.jpg,"Sold  Mar 30, 2025"
"3 View-Master Stereo 3D Reels # 5273-E, Yellowstone PNo. 2, National Park Geyser","284,608.09 VND",https://www.ebay.com/itm/187063719464,https://i.ebayimg.com/images/g/OIAAAOSw-m5n3EUO/s-l140.jpg,"Sold  Mar 30, 2025"
UGG BIRCH LACE UP SHEARLING WOMEN BOOTS SUEDE GEYSER,"1,431,100.00 VND",https://www.ebay.com/itm/226028105848,https://i.ebayimg.com/images/g/c4kAAOSwp9Fl0VD0/s-l140.jpg,"Sold  Mar 30, 2025"
Franco Sarto Sandals Womens 7.5 M Geyser Slingback Strappy Yellow Faux Leather,"473,303.80 VND",https://www.ebay.com/itm/196314650140,https://i.ebayimg.com/images/g/vKAAAOSw39VmA~Lc/s-l140.jpg,"Sold  Mar 29, 2025"
Yellowstone Montana 1960s Postcard Old Faithful Geyser ,"71,555.00 VND",https://www.ebay.com/itm/127019851601,https://i.ebayimg.com/images/g/26IAAOSwQvJn5xn-/s-l140.jpg,"Sold  Mar 29, 2025"
Crystal Geyser Natural Alpine Spring Water- 1 Gallon (3.78L) (2 Bottles),"546,159.80 VND",https://www.ebay.com/itm/176697407689,https://i.ebayimg.com/images/g/zdgAAOSwkFhm4Jh~/s-l140.jpg,"Sold  Mar 29, 2025"
"Black Pool, West Thumb Geyser Basin, Yellowstone National Park - Wyoming","90,029.20 VND",https://www.ebay.com/itm/156825748328,https://i.ebayimg.com/images/g/kXwAAOSwNUpjGWxu/s-l140.jpg,"Sold  Mar 29, 2025"
Complete 34 Frigost Figures Promo Krosmaster w/ Ice Cubes Geysers Trees + More!,"2,081,339.80 VND",https://www.ebay.com/itm/306160439991,https://i.ebayimg.com/images/g/NCcAAeSw159nyR3m/s-l140.jpg,"Sold  Mar 28, 2025"
Studies of Geysers and Hot Springs along the Firehole River Yellowstone Marler,"233,139.20 VND",https://www.ebay.com/itm/356163971323,https://i.ebayimg.com/images/g/xrcAAOSwWGpmgvxE/s-l140.jpg,"Sold  Mar 28, 2025"
"YELLOWSTONE OLD FAITHFUL GEYSER road sign 12""x18"" - US 191 scenic park DOT style","2,315,780.00 VND",https://www.ebay.com/itm/294185684451,https://i.ebayimg.com/images/g/jfAAAOSwHFhcvR6S/s-l140.jpg,"Sold  Mar 28, 2025"
1898 GEYSER YELLOWSTONE PARK and CAVES GROTTO Antique  Engraving Print,"58,545.00 VND",https://www.ebay.com/itm/236015176464,https://i.ebayimg.com/images/g/5TUAAOSwIVBn3bq6/s-l140.jpg,"Sold  Mar 28, 2025"
Dr Jim Stamps Postcard Geyser Springs Park Saratoga New York Undivided Unposted,"6,505.00 VND",https://www.ebay.com/itm/405681549640,https://i.ebayimg.com/images/g/jaoAAOSwYVBnqmsw/s-l140.jpg,"Sold  Mar 28, 2025"
WEARABLES Women Geyser Crop Pants Sz M Brown Pull on Ruched Grunge Boho,"773,834.80 VND",https://www.ebay.com/itm/176803431062,https://i.ebayimg.com/images/g/hkgAAOSwf9NnEZeo/s-l140.jpg,"Sold  Mar 28, 2025"
Vintage Photo ABSTRACT LANDSCAPE CLEPSYDRA GEYSER SIGN YELLOWSTONE,"233,659.60 VND",https://www.ebay.com/itm/405624443585,https://i.ebayimg.com/images/g/RYwAAeSw31FnzNO-/s-l140.jpg,"Sold  Mar 8, 2025"
Disney Lorcana TCG - Archazia's Island: Ink Geyser (119/204) - Rare - Near Mint ,"59,585.80 VND",https://www.ebay.com/itm/388144964274,https://i.ebayimg.com/images/g/38EAAeSwNmpn4ud~/s-l140.jpg,"Sold  Mar 27, 2025"
Dr Jim Stamps Postcard Old Faithful Geyser Erupting Yellowstone Linen Unposted,"52,040.00 VND",https://www.ebay.com/itm/396341230679,https://i.ebayimg.com/images/g/uOcAAOSwnYZn2HjZ/s-l140.jpg,"Sold  Mar 27, 2025"
Columbia Sun Protection Rash Guard Shirt Freezer Coil Women’s  SIZE SMALL Geyser,"546,159.80 VND",https://www.ebay.com/itm/285336547678,https://i.ebayimg.com/images/g/DzUAAOSwqB1kjiof/s-l140.jpg,"Sold  Mar 27, 2025"
New Zealand 1967-70 Used On Paper Pohutu Geyser sg 879 + 50c Sutherland Water NZ,"83,394.10 VND",https://www.ebay.com/itm/316525442149,https://i.ebayimg.com/images/g/iYIAAeSwxlxnt2Rf/s-l140.jpg,"Sold  Mar 27, 2025"
Mana Geyser Fifth Dawn Regular LP Lightly Played ,"78,060.00 VND",https://www.ebay.com/itm/226575352464,https://i.ebayimg.com/images/g/8ZAAAOSwqe1nnPtG/s-l140.jpg,"Sold  Mar 27, 2025"
MTG Mana Geyser (Rainbow Foil) Secret Lair Drop (SDL) #1821 Foil,"104,080.00 VND",https://www.ebay.com/itm/156825568226,https://i.ebayimg.com/images/g/S3MAAOSw9ttn4LXo/s-l140.jpg,"Sold  Mar 27, 2025"
Eileen Fisher Garment Dyed Linen Wide Leg Pants Geyser Sz Plus 3X NWT $168,"1,821,139.80 VND",https://www.ebay.com/itm/405619467056,https://i.ebayimg.com/images/g/spAAAeSwUsdny03l/s-l140.jpg,"Sold  Mar 26, 2025"
TropicFeel Geyser Litli HDry Mens White Gray Mesh Leather Shoes Size 12,"1,691,300.00 VND",https://www.ebay.com/itm/376048382815,https://i.ebayimg.com/images/g/EqcAAOSwTEtnypEN/s-l140.jpg,"Sold  Mar 25, 2025"
Geyser Drake X4 - Playset - OTJ - MTG - NM  Unplayed - EN - 0051,"18,292.71 VND",https://www.ebay.com/itm/387143756316,https://i.ebayimg.com/images/g/MEUAAOSwvJlmgVU-/s-l140.jpg,"Sold  Mar 24, 2025"
Mayfairstamps US 1941 Yellowstone Park Wyoming Oblong Geyser Crater Postcard aar,"26,020.00 VND",https://www.ebay.com/itm/116524506677,https://i.ebayimg.com/images/g/UeIAAOSwgV5n2DDK/s-l140.jpg,"Sold  Mar 24, 2025"
VINTAGE Yellowstone National Park Old Faithful Geyser SOUVENIR Pennant SHIP FAST,"382,233.80 VND",https://www.ebay.com/itm/126744932461,https://i.ebayimg.com/images/g/O3EAAOSw8FVnEBJn/s-l140.jpg,"Sold  Mar 24, 2025"
CALIFORNIA SV - Geyser Springs - Devil's Kitchen - JJ Reilly 1870s,"1,431,100.00 VND",https://www.ebay.com/itm/235928654723,https://i.ebayimg.com/images/g/MQcAAOSwwLlnk~3O/s-l140.jpg,"Sold  Mar 24, 2025"
Used Geyser Systems Portable Shower with Heater / Scrubs Cord New Sealed Packs,"8,196,300.00 VND",https://www.ebay.com/itm/335519478008,https://i.ebayimg.com/images/g/yh4AAOSwh7lmsgp1/s-l140.jpg,"Sold  Mar 24, 2025"
"Soda Springs Geyser, Idaho Postcard","159,242.40 VND",https://www.ebay.com/itm/356619179401,https://i.ebayimg.com/images/g/6TIAAOSwrdtnAixR/s-l140.jpg,"Sold  Mar 24, 2025"
Manchester United Geyse Signed Panini Womens Super League WSL Sticker,"333,242.82 VND",https://www.ebay.com/itm/176343925403,https://i.ebayimg.com/images/g/S8wAAOSw4G5mJVLZ/s-l140.jpg,"Sold  Sep 22, 2024"
Cosmic Geyser Freestanding Tumbler   Holder Matt White 2776551,"600,437.52 VND",https://www.ebay.com/itm/204667707939,https://i.ebayimg.com/images/g/dDMAAOSwZo1l2i9a/s-l140.jpg,"Sold  Mar 24, 2025"
WEARABLES CORE XCVI GEYSER CROP KNIT PANEL RUCHED CROPPED CAPRI LEGGING sz L,"780,339.80 VND",https://www.ebay.com/itm/236008035828,https://i.ebayimg.com/images/g/LGAAAOSwV6pnEqnK/s-l140.jpg,"Sold  Mar 23, 2025"
1x Mtg Conspiracy Mana Geyser NM Magic The Gathering,"99,712.54 VND",https://www.ebay.com/itm/186914126288,https://i.ebayimg.com/images/g/BEwAAOSwzNtnlmVk/s-l140.jpg,"Sold  Mar 23, 2025"
Steve Spangler's Geyser Tube Mentos Cola Fountain Fun Game Science DR 7,"199,140.19 VND",https://www.ebay.com/itm/146464216370,https://i.ebayimg.com/images/g/JW4AAOSw6Rln3Co0/s-l140.jpg,"Sold  Mar 23, 2025"
Real McCoy Geyser Sunglasses ,"9,107,000.00 VND",https://www.ebay.com/itm/116438304881,https://i.ebayimg.com/images/g/84EAAOSwgw1newy2/s-l140.jpg,"Sold  Mar 23, 2025"
"Geyse Da Silva Ferreira, Manchester United FC Women, 24/25 Club Card,Hand Signed","378,609.21 VND",https://www.ebay.com/itm/405650640598,https://i.ebayimg.com/images/g/mmUAAeSwtYtn0x4E/s-l140.jpg,"Sold  Mar 23, 2025"
1970s Pictures Slides CA OR NM + geysers site geothermal develop USGS research ,"1,300,739.80 VND",https://www.ebay.com/itm/326431275033,https://i.ebayimg.com/images/g/5LMAAeSw7aJnpGn~/s-l140.jpg,"Sold  Mar 23, 2025"
Mana Geyser - Rainbow Foil - Secret Lair - NM MTG Magic,"169,130.00 VND",https://www.ebay.com/itm/156773520026,https://i.ebayimg.com/images/g/pbMAAOSw5FFny8CO/s-l140.jpg,"Sold  Mar 23, 2025"
"Vintage Postcard OLD FAITHFUL INN, UPPER GEYSER BASIN, YELLOWSTONE PARK Ji-5","91,070.00 VND",https://www.ebay.com/itm/205329838540,https://i.ebayimg.com/images/g/iaQAAOSwAe5nxWhB/s-l140.jpg,"Sold  Mar 22, 2025"
Vintage Postcard Yellowstone National Park Old Faithful Inn Geyser,"147,793.60 VND",https://www.ebay.com/itm/396313474210,https://i.ebayimg.com/images/g/dhEAAOSwMI9nm~ya/s-l140.jpg,"Sold  Mar 22, 2025"
​Disney's Lorcana TCG - ARI - Ink Geyser Near Mint #119/204​,"49,311.13 VND",https://www.ebay.com/itm/126979239979,https://i.ebayimg.com/images/g/yMwAAeSwKXVnymAy/s-l140.jpg,"Sold  Mar 14, 2025"
YELLOWSTONE National Park - The Giant Geyser - Antique 1874 Engraving #C230,"350,255.22 VND",https://www.ebay.com/itm/363082524865,https://i.ebayimg.com/images/g/vUMAAOSwqK9fP9xq/s-l140.jpg,"Sold  Mar 22, 2025"
Eileen Fisher Cropped Lantern XL Geyser Gray/blue Pant $168,"1,976,219.00 VND",https://www.ebay.com/itm/256844625034,https://i.ebayimg.com/images/g/NqAAAOSwEiZnyLhw/s-l140.jpg,"Sold  Mar 22, 2025"
x1 MTG Mana Geyser LP Fifth Dawn Magic the Gathering MTG ,"65,050.00 VND",https://www.ebay.com/itm/205349341003,https://i.ebayimg.com/images/g/MJcAAOSwnR1n0gSk/s-l140.jpg,"Sold  Mar 21, 2025"
"7"" Yellowstone National Park  Old Faithful Geyser Souvenir Plate White Gold Trim","312,240.00 VND",https://www.ebay.com/itm/155189013580,https://i.ebayimg.com/images/g/ybgAAOSwsxxjOeMy/s-l140.jpg,"Sold  Mar 21, 2025"
Antique Geyser Springs Saratoga Mineral Water Pint ! READ,"1,301,000.00 VND",https://www.ebay.com/itm/187063721224,https://i.ebayimg.com/images/g/dIUAAOSwcFhn3EXw/s-l140.jpg,"Sold  Mar 21, 2025"
1887 NEW ZEALAND TETARATA TERRACES GEYSER Antique Chromolithograph Print,"51,779.80 VND",https://www.ebay.com/itm/236004907320,https://i.ebayimg.com/images/g/r8AAAOSwr1Vn1HzC/s-l140.jpg,"Sold  Mar 21, 2025"
Yellowstone NP Old Faithful World's Most Famous Geyser Shield Pin (202),"520,139.80 VND",https://www.ebay.com/itm/186526706653,https://i.ebayimg.com/images/g/LMcAAOSwFr5mgIc0/s-l140.jpg,"Sold  Mar 21, 2025"
"JG BRAYTON 1870s CALIFORNIA Stereoview Devil's Tea Kettle, Geysers ","5,490,220.00 VND",https://www.ebay.com/itm/126991810306,https://i.ebayimg.com/images/g/mXIAAOSwWkxn0ycv/s-l140.jpg,"Sold  Mar 20, 2025"
"WATKINS Pacific RR 1870s CALIFORNIA Stereoview Devil's Canyon Geysers, Sonoma Co","832,640.00 VND",https://www.ebay.com/itm/126991792730,https://i.ebayimg.com/images/g/B28AAOSwpN1n0yOu/s-l140.jpg,"Sold  Mar 20, 2025"
DISNEY WDW WILDERNESS LODGE FAB 4 MICKEY DONALD GOOFY MINNIE GEYSER WATCHING PIN,"520,139.80 VND",https://www.ebay.com/itm/266943782880,https://i.ebayimg.com/images/g/fAIAAOSwOFNmt396/s-l140.jpg,"Sold  Mar 20, 2025"
California SHASTA SPRINGS GEYSER 1899 Detroit Photographic 140 PMC Postcard W682,"520,139.80 VND",https://www.ebay.com/itm/306182915090,https://i.ebayimg.com/images/g/tiEAAeSw3e9n1uoV/s-l140.jpg,"Sold  Mar 20, 2025"
Two Pictures of Geyser Erupting in Yellowstone Park Antique Photo Lot Nature 10,"260,200.00 VND",https://www.ebay.com/itm/176512048907,https://i.ebayimg.com/images/g/MVYAAOSwKN5mjFfK/s-l140.jpg,"Sold  Mar 20, 2025"
NWT - XCVI Wearables - Geyser Crop -  Burndt Orange? Sz L,"1,821,139.80 VND",https://www.ebay.com/itm/186141658053,https://i.ebayimg.com/images/g/1jgAAOSw2TFlPv9e/s-l140.jpg,"Sold  Mar 20, 2025"
MTG Magic The Gathering Quicksilver Geyser Common Lightly Played,"45,014.60 VND",https://www.ebay.com/itm/387065792151,https://i.ebayimg.com/images/g/x~cAAOSwVxFmYygR/s-l140.jpg,"Sold  Mar 20, 2025"
OLD FAITHFUL GEYSER Yellowstone National Park Postcard Unposted C. 1930s,"167,829.00 VND",https://www.ebay.com/itm/356288041080,https://i.ebayimg.com/images/g/2f0AAOSwY2VidC9K/s-l140.jpg,"Sold  Nov 24, 2024"
Mens 100% Cotton Straight Leg Sweatpants - Beefy 8 oz - Geyser - Made in USA,"2,732,100.00 VND",https://www.ebay.com/itm/142512483004,https://i.ebayimg.com/images/g/HJgAAOSwmUBb5E~U/s-l500.jpg,"Sold  Mar 20, 2025"
c1905 Yellowstone National Park Riverside Geyser Wyoming WY Tuck Postcard,"388,999.00 VND",https://www.ebay.com/itm/256853852290,https://i.ebayimg.com/images/g/S2gAAOSw269n0Suk/s-l140.jpg,"Sold  Mar 20, 2025"
LOT/13 YELLOWSTONE NP Original 1906 Photos ICY GEYSERS SNOW SCENES Wyoming,"910,700.00 VND",https://www.ebay.com/itm/236005138771,https://i.ebayimg.com/images/g/AnQAAeSwSNln1LOK/s-l140.jpg,"Sold  Mar 19, 2025"
Yellowstone vintage linen postcard / Old Faithfull geyser,"13,010.00 VND",https://www.ebay.com/itm/267183585822,https://i.ebayimg.com/images/g/VXkAAOSwImJnwLgI/s-l140.jpg,"Sold  Mar 19, 2025"
CHAUVET DJ Geyser P7 RGBA+UV Penta LED Fog Machine Pyro Effect - FREE SHIPPING,"8,326,139.80 VND",https://www.ebay.com/itm/176842084795,https://i.ebayimg.com/images/g/2ygAAOSwBmpnrRQt/s-l140.jpg,"Sold  Mar 19, 2025"
