Title,Price,Link,Image Link,Sold Date
"Crystal Geyser Alpine Spring Water, 128 Fl Oz, 6 Ct","572,179.80 VND",https://www.ebay.com/itm/156658576817,https://i.ebayimg.com/images/g/fwEAAOSwETBnl7dX/s-l140.jpg,"Sold  Apr 9, 2025"
"Crystal Geyser Natural Alpine Spring Water, 16.9 Fl Oz","391,340.80 VND",https://www.ebay.com/itm/205264967096,https://i.ebayimg.com/images/g/Z1oAAeSwLgBnoWhX/s-l140.jpg,"Sold  Feb 5, 2025"
1930`s Bulova  SKY KING  2 TONE CASE Manual Wind Art Deco Geyser Watch,"4,163,200.00 VND",https://www.ebay.com/itm/256880070203,https://i.ebayimg.com/images/g/TpcAAOSwUZhngHYh/s-l140.jpg,"Sold  Apr 9, 2025"
1930`s Bulova  SKY KING  2 TONE CASE Manual Wind Art Deco Geyser Watch,"3,902,739.80 VND",https://www.ebay.com/itm/256866158000,https://i.ebayimg.com/images/g/TpcAAOSwUZhngHYh/s-l140.jpg,"Sold  Mar 28, 2025"
Norris Geyser Basin Yellowstone National Park Postcard,"103,819.80 VND",https://www.ebay.com/itm/185949560208,https://i.ebayimg.com/images/g/M08AAOSwMChkkJf5/s-l140.jpg,"Sold  Apr 9, 2025"
Castle Geyser Yellowstone National Park Postcard,"77,799.80 VND",https://www.ebay.com/itm/167251651241,https://i.ebayimg.com/images/g/oEgAAOSwjK5mt4Ij/s-l140.jpg,"Sold  Jan 14, 2025"
Mana Geyser Fifth Dawn (75/165) LP/NM MTG MAGIC BULK DISCOUNT,"64,529.60 VND",https://www.ebay.com/itm/226625616261,https://i.ebayimg.com/images/g/J6gAAOSwmEVnw~g5/s-l140.jpg,"Sold  Apr 9, 2025"
Mana Geyser Fifth Dawn (75/165) MTG MAGIC HP,"58,284.80 VND",https://www.ebay.com/itm/226625617729,https://i.ebayimg.com/images/g/sRcAAOSwhgtnw~jv/s-l140.jpg,"Sold  Mar 19, 2025"
Postcard Pinwheel Geyser Yellowstone National Park ,"152,217.00 VND",https://www.ebay.com/itm/388158591957,https://i.ebayimg.com/images/g/zzQAAOSwSGdn42YI/s-l140.jpg,"Sold  Apr 8, 2025"
Postcard Old Faithful Geyser Yellowstone National Park   L30,"50,739.00 VND",https://www.ebay.com/itm/316528874521,https://i.ebayimg.com/images/g/mioAAeSwW9Fn3X34/s-l140.jpg,"Sold  Mar 31, 2025"
Postcard Wyoming Lower Geyser Basin At Yellowstone National Park,"207,899.80 VND",https://www.ebay.com/itm/126492665287,https://i.ebayimg.com/images/g/GS8AAOSwg9dnFkFK/s-l140.jpg,"Sold  Jan 26, 2025"
Simer 2305 Geyser II 1/6HP Submersible Utility Pump 1320 gal/hr Black (Works),"832,640.00 VND",https://www.ebay.com/itm/316535122198,https://i.ebayimg.com/images/g/xW4AAeSwY1hn3w-j/s-l140.jpg,"Sold  Apr 8, 2025"
Simer 2110 Geyser Jr. |1/4 HP Submersible Utility Pump| 390 gal/hr Black,"1,248,960.00 VND",https://www.ebay.com/itm/176958225791,https://i.ebayimg.com/images/g/ZvwAAeSwQ3tn5XMc/s-l140.jpg,"Sold  Apr 2, 2025"
Simer 2300-01 Geyser III 1/6 HP Submersible Utility Pump 1260 gal/hr Blue 1J02R,"1,821,139.80 VND",https://www.ebay.com/itm/375924593383,https://i.ebayimg.com/images/g/2EMAAOSwPdVnhqt8/s-l140.jpg,"Sold  Mar 23, 2025"
Simer 2305 Geyser 1/6 HP Submersible Utility Pump 1260 gal/hr New Open Box,"1,535,180.00 VND",https://www.ebay.com/itm/235672012092,https://i.ebayimg.com/images/g/3sUAAOSwNvxmpnuk/s-l140.jpg,"Sold  Mar 5, 2025"
Simer 2305 Geyser II 1/4 HP Submersible Utility Pump 1320 gal/hr Black,"2,445,619.80 VND",https://www.ebay.com/itm/334696506517,https://i.ebayimg.com/images/g/S8EAAOSwdm1jvAoU/s-l140.jpg,"Sold  Feb 18, 2025"
Simer 2305 Geyser II 1/4 HP Submersible Utility Pump 1320 gal/hr Black,"935,419.00 VND",https://www.ebay.com/itm/296956530203,https://i.ebayimg.com/images/g/DAcAAOSw3tdnj~3L/s-l140.jpg,"Sold  Feb 12, 2025"
Rare Carlo Giannini  Stove top INOX Geyser espresso maker  3 Cup Made In Italy.,"2,081,600.00 VND",https://www.ebay.com/itm/405572384317,https://i.ebayimg.com/images/g/eo4AAOSwcDZnK6wK/s-l140.jpg,"Sold  Apr 7, 2025"
Carlo Giannini  stove top inox geyser espresso maker New in box. Made In Italy.,"1,105,850.00 VND",https://www.ebay.com/itm/176791882083,https://i.ebayimg.com/images/g/gEAAAOSw3Zxnh-Oh/s-l140.jpg,"Sold  Mar 21, 2025"
Carlo Giannini  stove top inox geyser espresso maker New in box. Made In Italy.,"1,821,400.00 VND",https://www.ebay.com/itm/116452895102,https://i.ebayimg.com/images/g/c2cAAOSwe0xkttou/s-l140.jpg,"Sold  Feb 4, 2025"
Carlo Giannini  stove top inox geyser espresso maker New in box. Made In Italy.,"1,821,400.00 VND",https://www.ebay.com/itm/115864289922,https://i.ebayimg.com/images/g/c2cAAOSwe0xkttou/s-l140.jpg,"Sold  Jan 17, 2025"
Keystone Stereoview of Pohutu Geyser in New Zealand From 600/1200 Card Set #1034,"38,769.80 VND",https://www.ebay.com/itm/197002794975,https://i.ebayimg.com/images/g/vgEAAOSwj85YRRZ5/s-l140.jpg,"Sold  Feb 16, 2025"
Keystone Stereoview of Pohutu Geyser in New Zealand From 600/1200 Card Set #1034,"25,759.80 VND",https://www.ebay.com/itm/205154136790,https://i.ebayimg.com/images/g/vgEAAOSwj85YRRZ5/s-l140.jpg,"Sold  Jan 30, 2025"
Eileen Fisher Women's $178 Woven Plissé Mock Neck Dress in Geyser size 3X,"1,430,839.80 VND",https://www.ebay.com/itm/135575128328,https://i.ebayimg.com/images/g/K9IAAOSw2qBnrXuf/s-l140.jpg,"Sold  Apr 7, 2025"
Eileen Fisher Women's $158 Woven Plissé Mock Neck Top in Geyser size XXS,"1,030,131.80 VND",https://www.ebay.com/itm/167313841309,https://i.ebayimg.com/images/g/ga8AAOSwv~FnrqP6/s-l140.jpg,"Sold  Apr 6, 2025"
Eileen Fisher Women's $178 Woven Plissé Mock Neck Dress in Geyser size L,"1,259,107.80 VND",https://www.ebay.com/itm/135575128331,https://i.ebayimg.com/images/g/K9IAAOSw2qBnrXuf/s-l140.jpg,"Sold  Feb 24, 2025"
Old Faithful Geyser Yellowstone National Park Vintage Linen Postcard B27,"182,140.00 VND",https://www.ebay.com/itm/186470311453,https://i.ebayimg.com/images/g/6bEAAOSw-sFmWzBU/s-l140.jpg,"Sold  Apr 7, 2025"
Old Faithful Geyser  Yellowstone National Park   Postcard,"93,932.20 VND",https://www.ebay.com/itm/326503868944,https://i.ebayimg.com/images/g/-dQAAOSwftllruUq/s-l140.jpg,"Sold  Mar 31, 2025"
Old Faithful Geyser Yellowstone National Park Linen Postcard,"58,545.00 VND",https://www.ebay.com/itm/226130174324,https://i.ebayimg.com/images/g/lRwAAOSwRKJmN6UN/s-l140.jpg,"Sold  Mar 23, 2025"
Old Faithful Geyser Sunrise Yellowstone National Park - Haynes Vintage Postcard,"1,039,759.20 VND",https://www.ebay.com/itm/226630000487,https://i.ebayimg.com/images/g/Fn0AAeSwxLJnx1jT/s-l140.jpg,"Sold  Mar 22, 2025"
Old Faithful Geyser Yellowstone National Park Postcard 1910,"162,625.00 VND",https://www.ebay.com/itm/355106918071,https://i.ebayimg.com/images/g/Bn8AAOSwwvRlKxCc/s-l140.jpg,"Sold  Mar 22, 2025"
Old Faithful Geyser Yellowstone National Park Linen Postcard,"58,545.00 VND",https://www.ebay.com/itm/326203064973,https://i.ebayimg.com/images/g/5hwAAOSwU6VmmHyf/s-l140.jpg,"Sold  Mar 19, 2025"
Old Faithful Geyser Yellowstone National Park Wyoming Vintage Postcard,"103,819.80 VND",https://www.ebay.com/itm/326192778399,https://i.ebayimg.com/images/g/7T8AAOSwhrFmjEL5/s-l140.jpg,"Sold  Feb 27, 2025"
Old Faithful Geyser Yellowstone National Park Linen Postcard UNP,"65,050.00 VND",https://www.ebay.com/itm/204736815430,https://i.ebayimg.com/images/g/SiMAAOSwjPJmFxz7/s-l140.jpg,"Sold  Feb 1, 2025"
Mana Geyser FOIL Fifth Dawn PLD Red Common MAGIC MTG CARD (ID# 490998) ABUGames,"348,407.80 VND",https://www.ebay.com/itm/277000045044,https://i.ebayimg.com/images/g/TooAAeSwegVn7Tk6/s-l140.jpg,"Sold  Apr 7, 2025"
Mana Geyser FOIL Fifth Dawn PLD Red Common MAGIC MTG CARD (ID# 486370) ABUGames,"406,172.20 VND",https://www.ebay.com/itm/326480557726,https://i.ebayimg.com/images/g/L9MAAeSwo4Znzxvr/s-l140.jpg,"Sold  Mar 15, 2025"
Mana Geyser FOIL Fifth Dawn NM Red Common MAGIC MTG CARD (ID# 483146) ABUGames,"417,360.80 VND",https://www.ebay.com/itm/326454909987,https://i.ebayimg.com/images/g/q7YAAeSwid1nuK~5/s-l140.jpg,"Sold  Feb 26, 2025"
Mana Geyser FOIL Fifth Dawn PLD Red Common MAGIC MTG CARD (ID# 486372) ABUGames,"325,250.00 VND",https://www.ebay.com/itm/276886959708,https://i.ebayimg.com/images/g/IUcAAeSwwlZnt5cA/s-l140.jpg,"Sold  Feb 25, 2025"
Mana Geyser FOIL Fifth Dawn PLD Red Common MAGIC MTG CARD (ID# 486371) ABUGames,"380,152.20 VND",https://www.ebay.com/itm/276846705510,https://i.ebayimg.com/images/g/qaQAAOSwX0ZnpTNM/s-l140.jpg,"Sold  Feb 11, 2025"
Mana Geyser FOIL Fifth Dawn NM Red Common MAGIC MTG CARD (ID# 483145) ABUGames,"455,350.00 VND",https://www.ebay.com/itm/326408209497,https://i.ebayimg.com/images/g/3VsAAOSwADZniWRA/s-l140.jpg,"Sold  Jan 21, 2025"
Crystal Geyser Alpine Spring Water 16.9 oz Bottle 35/Case 35001CT,"643,734.80 VND",https://www.ebay.com/itm/176674921644,https://i.ebayimg.com/images/g/wU8AAOSwzNNnMWhr/s-l140.jpg,"Sold  Apr 6, 2025"
Crystal Geyser Alpine Spring Water 16.9 oz Bottle 35/Case 35001CT,"624,219.80 VND",https://www.ebay.com/itm/365429215531,https://i.ebayimg.com/images/g/nTAAAOSwh1tg~t77/s-l140.jpg,"Sold  Mar 24, 2025"
Crystal Geyser Alpine Spring Water 1 Gal Bottle 6/Case 12514CT,"851,114.20 VND",https://www.ebay.com/itm/186842576956,https://i.ebayimg.com/images/g/DWMAAOSw7VJnXZBz/s-l140.jpg,"Sold  Feb 16, 2025"
"Vintage Postcard: Old Faithful Inn, Upper Geyser Basin, Yellowstone Park, WY.","25,759.80 VND",https://www.ebay.com/itm/176968550609,https://i.ebayimg.com/images/g/bpIAAOSwpdNn6d1~/s-l140.jpg,"Sold  Apr 6, 2025"
"Postcard Old Faithful Inn, Upper Geyser Basin, Yellowstone Park Wyoming","84,565.00 VND",https://www.ebay.com/itm/196849604512,https://i.ebayimg.com/images/g/xMUAAOSwbwdnRd8L/s-l140.jpg,"Sold  Mar 16, 2025"
Antique Postcard  Old Faithful Inn and Geyser Yellowstone NP,"25,759.80 VND",https://www.ebay.com/itm/267204286344,https://i.ebayimg.com/images/g/-GkAAOSw3Qtn6Jrx/s-l140.jpg,"Sold  Apr 5, 2025"
"Postcard WY Old Faithful Inn and Geyser, Yellowstone National Park A6","60,366.40 VND",https://www.ebay.com/itm/156268531141,https://i.ebayimg.com/images/g/fUoAAOSw2U1kl6rO/s-l140.jpg,"Sold  Jan 29, 2025"
Mana Geyser Fifth Dawn Regular,"39,030.00 VND",https://www.ebay.com/itm/186804116504,https://i.ebayimg.com/images/g/tpUAAOSwQY1nQn96/s-l140.jpg,"Sold  Dec 17, 2024"
Mana Geyser Fifth Dawn Regular X 1,"52,040.00 VND",https://www.ebay.com/itm/267197804757,https://i.ebayimg.com/images/g/Jm8AAeSwUAhn3-tW/s-l140.jpg,"Sold  Mar 26, 2025"
Mana Geyser [Fifth Dawn],"83,264.00 VND to 1,090,238.00 VND",https://www.ebay.com/itm/395937954716,https://i.ebayimg.com/images/g/D4cAAOSwAHFnRKkF/s-l140.jpg,"Sold  Nov 30, 2024"
Mana Geyser Fifth Dawn Regular,"35,127.00 VND",https://www.ebay.com/itm/396265718745,https://i.ebayimg.com/images/g/qwIAAOSwDZ1nemU~/s-l140.jpg,"Sold  Mar 9, 2025"
1x Mana Geyser Fifth Dawn mtg,"77,799.80 VND",https://www.ebay.com/itm/396153621786,https://i.ebayimg.com/images/g/j-kAAOSwmLFnlor0/s-l140.jpg,"Sold  Feb 9, 2025"
Mana Geyser Fifth Dawn Regular,"35,127.00 VND",https://www.ebay.com/itm/396134643991,https://i.ebayimg.com/images/g/qwIAAOSwDZ1nemU~/s-l140.jpg,"Sold  Jan 26, 2025"
Dr Jim Stamps Postcard Old Faithful Geyser Yellowstone National Park Wyoming,"53,861.40 VND",https://www.ebay.com/itm/286440164238,https://i.ebayimg.com/images/g/gMQAAOSwzyRn3YvQ/s-l140.jpg,"Sold  Apr 2, 2025"
1930's Postcard Of Old Faithful Geyser Yellowstone National Park,"117,090.00 VND",https://www.ebay.com/itm/355106915932,https://i.ebayimg.com/images/g/KbQAAOSwQRhlKxBt/s-l140.jpg,"Sold  Mar 31, 2025"
Postcard Old Faithful Inn and Geyser Yellowstone National Park Wyoming UDB 1905,"129,839.80 VND",https://www.ebay.com/itm/396192461167,https://i.ebayimg.com/images/g/eIYAAOSwpqFnqLrf/s-l140.jpg,"Sold  Mar 23, 2025"
Postcard Old Faithful Geyser Yellowstone National Park Wyoming USA,"83,524.20 VND",https://www.ebay.com/itm/396252003221,https://i.ebayimg.com/images/g/vuYAAOSw~7plCM0w/s-l140.jpg,"Sold  Mar 16, 2025"
Dr Jim Stamps Postcard Old Faithful Geyser Yellowstone National Park Wyoming,"24,198.60 VND",https://www.ebay.com/itm/405582124958,https://i.ebayimg.com/images/g/ArcAAOSw6NZntmcX/s-l140.jpg,"Sold  Mar 4, 2025"
"Postcard - Old Faithful Geyser - Yellowstone National Park, Wyoming","128,799.00 VND",https://www.ebay.com/itm/256748008452,https://i.ebayimg.com/images/g/NrEAAOSwY2xioqSj/s-l140.jpg,"Sold  Feb 1, 2025"
"Vintage Postcard Old Faithful Geyser, Yellowstone National Park","123,334.80 VND",https://www.ebay.com/itm/276830665313,https://i.ebayimg.com/images/g/n6cAAOSwE4RnlYnt/s-l140.jpg,"Sold  Jan 26, 2025"
"Postcard Old Faithful Geyser Yellowstone National Park, Wyoming F13","51,779.80 VND",https://www.ebay.com/itm/305097328596,https://i.ebayimg.com/images/g/6pYAAOSwMNtk6mna/s-l140.jpg,"Sold  Jan 15, 2025"
Dr Jim Stamps Postcard Giant Geyser Yellowstone Park Unposted,"33,826.00 VND",https://www.ebay.com/itm/286440162096,https://i.ebayimg.com/images/g/trEAAOSwYlZn3YvH/s-l140.jpg,"Sold  Apr 2, 2025"
Dr Jim Stamps Postcard Norris Geyser Basin Yellowstone Park Unposted,"48,137.00 VND",https://www.ebay.com/itm/286414748139,https://i.ebayimg.com/images/g/mDQAAOSwV3Fnz1Bb/s-l140.jpg,"Sold  Mar 23, 2025"
Dr Jim Stamps Postcard Grotto Geyser Formation Yellowstone Park Unposted,"6,505.00 VND",https://www.ebay.com/itm/396278708174,https://i.ebayimg.com/images/g/E-kAAOSwMRBnxikp/s-l140.jpg,"Sold  Mar 11, 2025"
Dr Jim Stamps Postcard Sponge Geyser Yellowstone Park Unposted,"9,107.00 VND",https://www.ebay.com/itm/396230514692,https://i.ebayimg.com/images/g/oyIAAOSwnfNnqopB/s-l140.jpg,"Sold  Feb 27, 2025"
Dr Jim Stamps Postcard Riverside Geyser Yellowstone Park White Border Unposted,"32,525.00 VND",https://www.ebay.com/itm/286332386973,https://i.ebayimg.com/images/g/U6MAAOSwNiRnqmy1/s-l140.jpg,"Sold  Feb 22, 2025"
Dr Jim Stamps Giant Geyser 250 Foot Yellowstone Park Unposted,"26,280.20 VND",https://www.ebay.com/itm/405533753945,https://i.ebayimg.com/images/g/5ecAAOSwJTFnoT5q/s-l140.jpg,"Sold  Feb 16, 2025"
Dr Jim Stamps Postcard Riverside Geyser Yellowstone Park Unposted,"331,494.80 VND",https://www.ebay.com/itm/286301749066,https://i.ebayimg.com/images/g/BKEAAOSwD9JnnNy-/s-l140.jpg,"Sold  Feb 11, 2025"
Dr Jim Stamps Postcard Norris Geyser Basin Yellowstone Park Unposted,"16,913.00 VND",https://www.ebay.com/itm/396169802728,https://i.ebayimg.com/images/g/72EAAOSw8FtnnNSX/s-l140.jpg,"Sold  Feb 9, 2025"
"Yellowstone National Park WY-Wyoming, Old Faithful Geyser  Vintage Postcard","77,799.80 VND",https://www.ebay.com/itm/405547373466,https://i.ebayimg.com/images/g/HQwAAOSwbwFnryd0/s-l140.jpg,"Sold  Apr 2, 2025"
c1920 Yellowstone National Park WY Old Faithful Geyser WB Postcard,"74,677.40 VND",https://www.ebay.com/itm/276930807109,https://i.ebayimg.com/images/g/emkAAeSwLaRnzIAI/s-l140.jpg,"Sold  Mar 31, 2025"
"Yellowstone Park WY-Wyoming, Old Faithful Geyser, Vintage Postcard","103,819.80 VND",https://www.ebay.com/itm/235946297168,https://i.ebayimg.com/images/g/cogAAOSw32pnlWrQ/s-l140.jpg,"Sold  Mar 23, 2025"
Yellowstone National Park Old Faithful Geyser Vintage c1975 Postcard Postal Post,"25,759.80 VND",https://www.ebay.com/itm/405624372265,https://i.ebayimg.com/images/g/AKoAAeSwMCRnzMhQ/s-l140.jpg,"Sold  Mar 15, 2025"
Yellowstone National Park Old Faithful Inn And Geyser Vintage Postcard Old Post,"25,759.80 VND",https://www.ebay.com/itm/405624372273,https://i.ebayimg.com/images/g/~4UAAeSw7NpnzMi9/s-l140.jpg,"Sold  Mar 15, 2025"
Yellowstone National Park Old Faithful Geyser And Bus Vintage Postcard Postal PC,"25,759.80 VND",https://www.ebay.com/itm/405600093618,https://i.ebayimg.com/images/g/5e4AAeSwe39nxQ1o/s-l140.jpg,"Sold  Mar 9, 2025"
"Yellowstone National Park, Old Faithful Inn And Geyser, Vintage Postcard","25,759.80 VND",https://www.ebay.com/itm/405533259805,https://i.ebayimg.com/images/g/RsYAAOSwkC5npoxC/s-l140.jpg,"Sold  Feb 16, 2025"
"Yellowstone National Park, Old Faithful Geyser, Series #10378, Vintage Postcard","25,759.80 VND",https://www.ebay.com/itm/405533259871,https://i.ebayimg.com/images/g/fgkAAOSwQzRnpowt/s-l140.jpg,"Sold  Feb 16, 2025"
Yellowstone National Park Haynes #198 Old Faithful Geyser in Winter Postcard,"442,079.80 VND",https://www.ebay.com/itm/267149016035,https://i.ebayimg.com/images/g/DisAAOSwMvtmz-cu/s-l140.jpg,"Sold  Feb 13, 2025"
"Yellowstone Nat'l Park WY-Wyoming, Old Faithful Geyser @ Sunrise, Linen Postcard","77,799.80 VND",https://www.ebay.com/itm/405320874605,https://i.ebayimg.com/images/g/1j0AAOSwJo1nJMjn/s-l140.jpg,"Sold  Feb 8, 2025"
Yellowstone Natl Park WY Old Faithful Geyser unused vintage postcard sku467,"233,919.80 VND",https://www.ebay.com/itm/267127263488,https://i.ebayimg.com/images/g/Dl8AAOSwv8lnicLL/s-l140.jpg,"Sold  Jan 26, 2025"
Yellowstone Natl Park WY Old Faithful Geyser mailed 1911 vintage postcard,"233,919.80 VND",https://www.ebay.com/itm/326408537243,https://i.ebayimg.com/images/g/LlkAAOSw~YBnicMi/s-l140.jpg,"Sold  Jan 26, 2025"
"Yellowstone National Park WY-Wyoming, Oblong Geyser Crater, Vintage Postcard","20,555.80 VND",https://www.ebay.com/itm/405480475849,https://i.ebayimg.com/images/g/eLEAAOSwBsdngUTZ/s-l140.jpg,"Sold  Jan 25, 2025"
"Yellowstone Park WY-Wyoming, Giant Geyser, Vintage Postcard","32,525.00 VND",https://www.ebay.com/itm/405472149990,https://i.ebayimg.com/images/g/ZxQAAOSwkNRngTxC/s-l140.jpg,"Sold  Jan 21, 2025"
"Yellowstone Park WY-Wyoming, Daisy Geyser, Vintage Postcard","54,642.00 VND",https://www.ebay.com/itm/405472149799,https://i.ebayimg.com/images/g/O48AAOSwI4lngTuY/s-l140.jpg,"Sold  Jan 21, 2025"
"Yellowstone Park WY-Wyoming, Old Faithful Geyser, Vintage Postcard","54,642.00 VND",https://www.ebay.com/itm/405472149803,https://i.ebayimg.com/images/g/r1YAAOSwarpngTw7/s-l140.jpg,"Sold  Jan 21, 2025"
VINTAGE PHOTOGRAPH NORRIS GEYSER BASIN YELLOWSTONE NATIONAL PARK WYOMING PHOTO,"156,120.00 VND",https://www.ebay.com/itm/176549525431,https://i.ebayimg.com/images/g/1g8AAOSwNmRmw6Bb/s-l140.jpg,"Sold  Apr 2, 2025"
"VINTAGE POSTCARD UPPER GEYSER BASIN, YELLOWSTONE NATIONAL PARK, HAYNES PHOTO","128,799.00 VND",https://www.ebay.com/itm/185948259501,https://i.ebayimg.com/images/g/A4QAAOSwhkhkj3dl/s-l140.jpg,"Sold  Feb 20, 2025"
"Postcard Upper Geyser Basin, Yellowstone National Park, Wyoming","90,029.20 VND",https://www.ebay.com/itm/156788687545,https://i.ebayimg.com/images/g/wpkAAOSwre5lEiSQ/s-l140.jpg,"Sold  Apr 1, 2025"
"Beehive Geyser-Upper Geyser Basin-Yellowstone National Park, Wyoming","41,371.80 VND",https://www.ebay.com/itm/255836017700,https://i.ebayimg.com/images/g/3DEAAOSw5XFjeQiE/s-l140.jpg,"Sold  Mar 19, 2025"
Postcard Mud Geyser Norris Geyser Basin Yellowstone National Park Wyoming  10259,"336,959.00 VND",https://www.ebay.com/itm/404630304666,https://i.ebayimg.com/images/g/yZQAAOSwLYhlTsy6/s-l140.jpg,"Sold  Feb 12, 2025"
"STICKER,DECAL RENAULT 4  CAR ? SOMSEN SERVICE WACHT EIBERGEN TV GEYSER CV A","142,161.60 VND",https://www.ebay.com/itm/135662149345,https://i.ebayimg.com/images/g/RDcAAOSwWUJfrQpr/s-l140.jpg,"Sold  Mar 31, 2025"
"STICKER,DECAL RENAULT 4  CAR ? SOMSEN SERVICE WACHT EIBERGEN TV GEYSER CV A","142,161.60 VND",https://www.ebay.com/itm/114514114550,https://i.ebayimg.com/images/g/RDcAAOSwWUJfrQpr/s-l140.jpg,"Sold  Mar 30, 2025"
UGG TASMAN X GEYSER RAIN CLOG GREY WATERPROOF WOMEN'S SHOES SIZE US 7/UK 5 NEW,"1,691,039.80 VND",https://www.ebay.com/itm/286013105900,https://i.ebayimg.com/images/g/WWEAAOSwkkJmvkmC/s-l140.jpg,"Sold  Mar 31, 2025"
UGG TASMAN X GEYSER RAIN CLOG GREY WATERPROOF WOMEN'S SHOES SIZE US 8/UK 6 NEW,"1,691,039.80 VND",https://www.ebay.com/itm/286079760723,https://i.ebayimg.com/images/g/jMoAAOSwvM1m9YJp/s-l140.jpg,"Sold  Feb 10, 2025"
Yellowstone National Park Upper Geyser Basin Old Faithful Postcard Old Vintage,"13,010.00 VND",https://www.ebay.com/itm/365472654020,https://i.ebayimg.com/images/g/UQ0AAOSw~3Rn3I0D/s-l140.jpg,"Sold  Mar 30, 2025"
Yellowstone National Park Upper Geyser Basin Castle Postcard Old Vintage Card PC,"13,010.00 VND",https://www.ebay.com/itm/365411965103,https://i.ebayimg.com/images/g/cIUAAOSwlgJnt4yj/s-l140.jpg,"Sold  Mar 2, 2025"
Yellowstone National Park Lower Geyser Basin White Dome Postcard Old Vintage PC,"13,010.00 VND",https://www.ebay.com/itm/316268834833,https://i.ebayimg.com/images/g/OM4AAOSw3W1nrkqV/s-l140.jpg,"Sold  Feb 23, 2025"
Ink Geyser 119/204 Rare Archazia's Island,"26,020.00 VND",https://www.ebay.com/itm/405706980877,https://i.ebayimg.com/images/g/TjIAAOSw785n0iuH/s-l140.jpg,"Sold  Mar 30, 2025"
Ink Geyser (Cold Foil) 119/204 Rare Archazia's Island Mint,"143,110.00 VND",https://www.ebay.com/itm/197105845317,https://i.ebayimg.com/images/g/Yu8AAeSwn5xn02bw/s-l140.jpg,"Sold  Mar 21, 2025"
Ink Geyser 119/204 Rare Archazia's Island,"39,030.00 VND",https://www.ebay.com/itm/405646274831,https://i.ebayimg.com/images/g/TjIAAOSw785n0iuH/s-l500.jpg,"Sold  Mar 15, 2025"
Ink Geyser Rare 119/204 Lorcana Archazia's Island NM,"39,030.00 VND",https://www.ebay.com/itm/306181267402,https://i.ebayimg.com/images/g/EPwAAeSwoPRn1bIj/s-l140.jpg,"Sold  Mar 18, 2025"
Ink Geyser Rare 119/204 Lorcana Archazia's Island NM,"156,120.00 VND",https://www.ebay.com/itm/306183243893,https://i.ebayimg.com/images/g/QOAAAeSwwBdn14jc/s-l140.jpg,"Sold  Mar 16, 2025"
Ink Geyser (Cold Foil) 119/204 Rare Archazia's Island,"156,120.00 VND",https://www.ebay.com/itm/405646411088,https://i.ebayimg.com/images/g/WDcAAOSwdI9n0jR-/s-l140.jpg,"Sold  Mar 14, 2025"
Mana Geyser  1x  MTG Conspiracy NM Magic The Gathering,"77,539.60 VND",https://www.ebay.com/itm/196823804841,https://i.ebayimg.com/images/g/Z14AAOSwTuFnOpZI/s-l140.jpg,"Sold  Mar 29, 2025"
Mana Geyser  1x  MTG Conspiracy NM Magic The Gathering,"32,525.00 VND",https://www.ebay.com/itm/326489744982,https://i.ebayimg.com/images/g/5-oAAOSwzbZn110l/s-l140.jpg,"Sold  Mar 22, 2025"
2010 S Yellowstone Park ATB Quarter 90% SILVER Proof Geyser Bison Buffalo Wyomin,"207,379.40 VND",https://www.ebay.com/itm/356705507357,https://i.ebayimg.com/images/g/ETsAAOSwjGpjx0AT/s-l140.jpg,"Sold  Mar 29, 2025"
2010 S Yellowstone Park ATB Quarter 90% SILVER Proof Geyser Bison Buffalo Wyomin,"202,175.40 VND",https://www.ebay.com/itm/356632134924,https://i.ebayimg.com/images/g/ETsAAOSwjGpjx0AT/s-l140.jpg,"Sold  Mar 10, 2025"
2010 S Yellowstone Park ATB Quarter 90% SILVER Proof Geyser Bison Buffalo Wyomin,"207,379.40 VND",https://www.ebay.com/itm/356439190506,https://i.ebayimg.com/images/g/ETsAAOSwjGpjx0AT/s-l140.jpg,"Sold  Jan 15, 2025"
Ink Geyser 119/204 Rare COLD FOIL Disney Lorcana - Archazia's Island NM,"174,334.00 VND",https://www.ebay.com/itm/267197378346,https://i.ebayimg.com/images/g/KhIAAOSwtHZn30dh/s-l140.jpg,"Sold  Mar 28, 2025"
Ink Geyser 119/204 Rare COLD FOIL Disney Lorcana - Archazia's Island NM,"182,140.00 VND",https://www.ebay.com/itm/226658717870,https://i.ebayimg.com/images/g/jh4AAOSwVJdn3gna/s-l140.jpg,"Sold  Mar 22, 2025"
Ink Geyser 119/204 Rare COLD FOIL Disney Lorcana - Archazia's Island NM,"169,130.00 VND",https://www.ebay.com/itm/356695760934,https://i.ebayimg.com/images/g/0nIAAeSwsONn3bwB/s-l140.jpg,"Sold  Mar 21, 2025"
Ink Geyser 119/204 Rare COLD FOIL Disney Lorcana - Archazia's Island NM,"233,919.80 VND",https://www.ebay.com/itm/405633067510,https://i.ebayimg.com/images/g/S2QAAOSwmSpnzuU5/s-l140.jpg,"Sold  Mar 17, 2025"
Ink Geyser 119/204 Rare COLD FOIL Disney Lorcana - Archazia's Island NM,"32,525.00 VND",https://www.ebay.com/itm/146446900991,https://i.ebayimg.com/images/g/mgcAAeSwOBhn0szx/s-l140.jpg,"Sold  Mar 13, 2025"
"Upper Geyser Basin, Yellowstone Park Vintage Postcard ","67,391.80 VND",https://www.ebay.com/itm/205367717013,https://i.ebayimg.com/images/g/P2EAAOSwfPVm7PVb/s-l140.jpg,"Sold  Mar 27, 2025"
The Sponge Upper Geyser Basin Yellowstone Park Postcard,"43,973.80 VND",https://www.ebay.com/itm/156650138223,https://i.ebayimg.com/images/g/HNsAAOSwexxnZEbU/s-l140.jpg,"Sold  Jan 29, 2025"
Parks Project Yellowstone Geysers Trail High Pile Fleece Small Green Pullover,"1,821,400.00 VND",https://www.ebay.com/itm/197146720605,https://i.ebayimg.com/images/g/2RIAAOSwTCtn4xK4/s-l140.jpg,"Sold  Mar 27, 2025"
Parks Project Yellowstone Geysers Trail High Pile Fleece Pullover - Unsex Size M,"3,642,800.00 VND",https://www.ebay.com/itm/405635792376,https://i.ebayimg.com/images/g/oBYAAOSwV4Bnz7Ca/s-l140.jpg,"Sold  Mar 18, 2025"
NWT Parks Project Yellowstone Geysers Trail High Pile Fleece T-Snap Jacket XXL,"3,903,000.00 VND",https://www.ebay.com/itm/305672275493,https://i.ebayimg.com/images/g/VA8AAOSwF5BmktI6/s-l140.jpg,"Sold  Mar 10, 2025"
Parks Project Yellowstone Geysers Trail High Pile Fleece XLarge Green Pullover,"2,341,539.80 VND",https://www.ebay.com/itm/116486462096,https://i.ebayimg.com/images/g/rVQAAeSwhjlntj-F/s-l140.jpg,"Sold  Feb 21, 2025"
Parks Project Yellowstone Geysers Trail High Pile Fleece Large Green Pullover,"3,121,099.00 VND",https://www.ebay.com/itm/267141874988,https://i.ebayimg.com/images/g/lIoAAOSwlJhnnODc/s-l140.jpg,"Sold  Feb 19, 2025"
Parks Project Yellowstone Geysers Trail High Pile Fleece T-Snap Jacket Small,"1,977,520.00 VND",https://www.ebay.com/itm/146348423587,https://i.ebayimg.com/images/g/tdwAAOSw2HNnktcM/s-l140.jpg,"Sold  Feb 13, 2025"
Parks Projects Urban Outfitters Geysers Trail High Pile Fleece Sweatshirt Large,"2,341,539.80 VND",https://www.ebay.com/itm/226585884689,https://i.ebayimg.com/images/g/WJgAAeSwRCdnpXF0/s-l140.jpg,"Sold  Mar 24, 2025"
Parks Projects Urban Outfitters Geysers Trail High Pile Fleece Sweatshirt Small,"2,341,539.80 VND",https://www.ebay.com/itm/226585885840,https://i.ebayimg.com/images/g/1DYAAOSwnlNnpXJk/s-l140.jpg,"Sold  Mar 3, 2025"
Parks Projects Urban Outfitters Geysers Trail High Pile Fleece Sweatshirt XL,"2,341,539.80 VND",https://www.ebay.com/itm/226614431354,https://i.ebayimg.com/images/g/wWwAAeSwm5tnux~0/s-l140.jpg,"Sold  Mar 2, 2025"
MTG / Mana Geyser / SLD / #1821 / RAINBOW FOIL / Rare / NM,"188,645.00 VND",https://www.ebay.com/itm/365437113894,https://i.ebayimg.com/images/g/BikAAOSwJXFnqlPB/s-l140.jpg,"Sold  Mar 22, 2025"
MTG / Mana Geyser / SLD / #1821 / RAINBOW FOIL / Rare / NM,"233,919.80 VND",https://www.ebay.com/itm/365390569082,https://i.ebayimg.com/images/g/BikAAOSwJXFnqlPB/s-l140.jpg,"Sold  Feb 13, 2025"
MTG / Mana Geyser / SLD / #1821 / Regular / Rare / NM,"272,949.80 VND",https://www.ebay.com/itm/365372601361,https://i.ebayimg.com/images/g/zNkAAOSwG9xnnF5q/s-l140.jpg,"Sold  Feb 8, 2025"
