Title,Price,Link,Image Link,Sold Date
500 Piece Puzzles NEW Set Of 2 Puzzlebug Cra-Z-Art Paris Flower Stand-Fly Geyser,"260,200.00 VND",https://www.ebay.com/itm/405569216450,https://i.ebayimg.com/images/g/ppwAAOSw1-1mhD88/s-l140.jpg,"Sold  Feb 25, 2025"
"NATIONAL PARKS PC ""Old Faithful Geyser, Yellowstone"" 8-18-1936 Yellowstone, WY.","36,167.80 VND",https://www.ebay.com/itm/355755163671,https://i.ebayimg.com/images/g/K8MAAOSw-01mCCnl/s-l140.jpg,"Sold  Feb 24, 2025"
Vintage Wyoming Yellowstone Faithful Riverside Norris Geysers 3 Postcard Lot,"38,249.40 VND",https://www.ebay.com/itm/396226335207,https://i.ebayimg.com/images/g/5AcAAOSwPPVnqBZF/s-l140.jpg,"Sold  Feb 24, 2025"
Oblong Geyser & The Mole River Yellowstone Park N.A. Forsyth Stereoview,"1,170,900.00 VND",https://www.ebay.com/itm/387821064409,https://i.ebayimg.com/images/g/1agAAOSwF7lnebMC/s-l140.jpg,"Sold  Feb 24, 2025"
Lone Star Geyser Yellowstone Park N.A. Forsyth Stereoview,"1,170,900.00 VND",https://www.ebay.com/itm/387821064415,https://i.ebayimg.com/images/g/Jh8AAOSwpAVnebNZ/s-l140.jpg,"Sold  Feb 24, 2025"
Geyser System Scrub Replacement Sponge for The Portable Shower & Cleaning Kit...,"621,097.40 VND",https://www.ebay.com/itm/167278556469,https://i.ebayimg.com/images/g/XoUAAOSwlJxnl785/s-l500.jpg,"Sold  Jan 27, 2025"
"Vintage 1900 YELLOWSTONE PARK Map 11""x14"" ~ Antique Original OLD FAITHFUL GEYSER","1,216,695.20 VND",https://www.ebay.com/itm/235915825993,https://i.ebayimg.com/images/g/rhoAAOSw8RdlStqI/s-l500.jpg,"Sold  Feb 23, 2025"
Yellowstone National Park collectors token Wyoming USA coin Old Faithful Geyser,"131,661.20 VND",https://www.ebay.com/itm/387953476627,https://i.ebayimg.com/images/g/TA0AAOSw9AVnseRb/s-l140.jpg,"Sold  Feb 23, 2025"
NEW Eileen Fisher GEYSER Organic Linen Cotton Jersey Long Cardigan 1X #T2500,"1,873,179.80 VND",https://www.ebay.com/itm/205124546187,https://i.ebayimg.com/images/g/myUAAOSwOnFmg10h/s-l140.jpg,"Sold  Feb 23, 2025"
"Postcard: OLD FAITHFUL INN AND GEYSER, YELLOWSTONE NATIONAL PARK","117,090.00 VND",https://www.ebay.com/itm/395723468354,https://i.ebayimg.com/images/g/eHcAAOSwGDFm82b3/s-l140.jpg,"Sold  Feb 22, 2025"
Vtg Wyoming WY Yellowstone National Park Daisy Geyser 1940s Linen View Postcard,"103,819.80 VND",https://www.ebay.com/itm/335774493147,https://i.ebayimg.com/images/g/CdkAAOSwanNksbM7/s-l140.jpg,"Sold  Feb 22, 2025"
View up Devil's Canyon Geyser Springs CA Bierstadt Stereoview c1870,"1,209,930.00 VND",https://www.ebay.com/itm/387951326442,https://i.ebayimg.com/images/g/mRsAAOSwcHpnsU1I/s-l140.jpg,"Sold  Feb 22, 2025"
Grotto Geyser Cone Yellowstone Park TW Ingersoll Stereoview c1870,"540,175.20 VND",https://www.ebay.com/itm/387951199774,https://i.ebayimg.com/images/g/NHsAAOSwtldnsUMf/s-l140.jpg,"Sold  Feb 22, 2025"
Mana Geyser (1821) *Non-Foil* SECRET LAIR Extra Life 2024 MTG MT/NM Comb Ship,"181,879.80 VND",https://www.ebay.com/itm/205082517902,https://i.ebayimg.com/images/g/6rYAAOSwDExnKBmP/s-l140.jpg,"Sold  Feb 22, 2025"
ZOMBICIDE: UNDEAD OR ALIVE Dead West GORE GEYSER Mini & Card NEW!!,"388,999.00 VND",https://www.ebay.com/itm/226609542572,https://i.ebayimg.com/images/g/mTkAAOSwGw9ntyVD/s-l140.jpg,"Sold  Feb 22, 2025"
VAILLANT TEMPERATURE SELECTOR 012546 GEYSER MAG TURBO 350/9 EW WATER HEATER,"910,233.07 VND",https://www.ebay.com/itm/314148335601,https://i.ebayimg.com/images/g/CnEAAOSwkgVjIwe2/s-l140.jpg,"Sold  Feb 22, 2025"
Rare Colorscope Stereoview Color Slide Yellowstone Falls Geyser M-32 3D 11 Image,"292,725.00 VND",https://www.ebay.com/itm/265952591868,https://i.ebayimg.com/images/g/y9YAAOSwkdtjRxTM/s-l140.jpg,"Sold  Feb 22, 2025"
Columbia Womens Long Sleeve Shirt Size XL Freezer Coil Omni-Wick Geyser Blue,"441,039.00 VND",https://www.ebay.com/itm/186936522584,https://i.ebayimg.com/images/g/2OsAAOSwMftnppJm/s-l140.jpg,"Sold  Feb 21, 2025"
Superior Wisconsin Geyser Hutch Soda Glass Antique Old Bottle 1800s,"650,239.80 VND",https://www.ebay.com/itm/186960360082,https://i.ebayimg.com/images/g/Y0gAAOSwqllnsopt/s-l140.jpg,"Sold  Feb 21, 2025"
"Old Faithful Geyser, Yellowstone. VTG UNP Postcard, Y-159 45190 D. Dexter.","169,130.00 VND",https://www.ebay.com/itm/256816541890,https://i.ebayimg.com/images/g/at8AAOSww0dnd1DZ/s-l140.jpg,"Sold  Feb 20, 2025"
DJ Geyser T6 Vertical Pyrotechnic-Like 6 RGB LED Fog Machine With Remote US 900W,"2,348,565.20 VND",https://www.ebay.com/itm/146046864524,https://i.ebayimg.com/images/g/PEMAAOSwXmlnG2UN/s-l140.jpg,"Sold  Feb 19, 2025"
UGG Australia BAILEY BOW II METALLIC Geyser Black SUEDE SHEEPSKIN BOOTS. Sz. 9,"1,431,100.00 VND",https://www.ebay.com/itm/365390814977,https://i.ebayimg.com/images/g/9IUAAOSwIS1nqopZ/s-l140.jpg,"Sold  Feb 20, 2025"
"Yellowstone National Park Iron On Patch Geyser 2.5""x3"" Embroidered Colorful NEW","259,939.80 VND",https://www.ebay.com/itm/135174451755,https://i.ebayimg.com/images/g/y1oAAOSwyvBmMmyf/s-l140.jpg,"Sold  Feb 20, 2025"
Parks Project Jogger Adult Small Yellowstone Geysers High Pile Fleece Brown NWOT,"2,078,477.60 VND",https://www.ebay.com/itm/276850301115,https://i.ebayimg.com/images/g/mcQAAOSwia9npuhu/s-l140.jpg,"Sold  Feb 20, 2025"
Postcard Constant Geyser Norris Basin Yellowstone National Park Wyoming Haynes,"110,585.00 VND",https://www.ebay.com/itm/185920668224,https://i.ebayimg.com/images/g/b88AAOSwDFhkdr74/s-l140.jpg,"Sold  Feb 20, 2025"
YELLOWSTONE NATIONAL PARK WYOMING WY Giant Geyser No. 353 Postcard,"257,337.80 VND",https://www.ebay.com/itm/365395245664,https://i.ebayimg.com/images/g/wcwAAeSws-5nrTt~/s-l140.jpg,"Sold  Feb 19, 2025"
Andrews Geyser Fountain Round Knob North Carolina Southern Railway litho,"101,478.00 VND",https://www.ebay.com/itm/225260526753,https://i.ebayimg.com/images/g/z8sAAOSwFnVeWO9~/s-l140.jpg,"Sold  Feb 19, 2025"
(4884) Iceland 1938~47 Geyser 50a,"108,763.60 VND",https://www.ebay.com/itm/256812434646,https://i.ebayimg.com/images/g/A4gAAOSwXDVnm9EB/s-l140.jpg,"Sold  Feb 19, 2025"
Comfort Colors Men's Yellowstone National Park T-shirt XL Green Geyser Views Tee,"641,393.00 VND",https://www.ebay.com/itm/297007210508,https://i.ebayimg.com/images/g/xQIAAOSwXD9nq4MV/s-l140.jpg,"Sold  Feb 19, 2025"
Vintage Postcard 1910s or 1920s Grotto Geyser Formation Yellowstone Park ,"331,234.60 VND",https://www.ebay.com/itm/267143810894,https://i.ebayimg.com/images/g/RZgAAOSwWxlnn-7s/s-l140.jpg,"Sold  Feb 19, 2025"
UGG ANSLEY FUR BOW GEYSER SHEARLING MOCCASIN SHOE US 12 / EU 43 / UK 10,"2,575,980.00 VND",https://www.ebay.com/itm/256746950335,https://i.ebayimg.com/images/g/grAAAOSwDaxnWXQf/s-l140.jpg,"Sold  Feb 18, 2025"
Geyser Soda Springs Natural Mineral Water-Pristine Mint Bottle,"1,014,780.00 VND",https://www.ebay.com/itm/297025809175,https://i.ebayimg.com/images/g/ojIAAeSwIh1nsmfq/s-l140.jpg,"Sold  Feb 18, 2025"
Old Faithful Geyser of California CA Calistoga Travel Collectible Patch,"415,019.00 VND",https://www.ebay.com/itm/276794800907,https://i.ebayimg.com/images/g/7H8AAOSw4c9nbxwZ/s-l140.jpg,"Sold  Feb 18, 2025"
2022-23 Topps Chrome FC Barcelona X-Fractor Geyse #55 Rookie RC,"163,665.80 VND",https://www.ebay.com/itm/235838824976,https://i.ebayimg.com/images/g/cG0AAOSw9w1nPghf/s-l140.jpg,"Sold  Jan 26, 2025"
2023 Topps Chrome FC Barcelona: Més Que Un Club Geyse,"64,789.80 VND",https://www.ebay.com/itm/235836722364,https://i.ebayimg.com/images/g/TLAAAOSwYkFnPCU~/s-l140.jpg,"Sold  Jan 13, 2025"
Mana Geyser - CNS - MTG - Hoovers' Cards,"78,529.33 VND",https://www.ebay.com/itm/296721940153,https://i.ebayimg.com/images/g/Y9QAAOSwKRJngF15/s-l140.jpg,"Sold  Feb 17, 2025"
Yellowstone National Park Montana~Upper Geyser Basin~c1910 Detroit Pub PC,"338,260.00 VND",https://www.ebay.com/itm/146393759561,https://i.ebayimg.com/images/g/st0AAOSwGfplEkca/s-l140.jpg,"Sold  Feb 17, 2025"
"Yellowstone National Park MT, Giant Geyser Cone, Montana c1942 Vintage Postcard","27,060.80 VND",https://www.ebay.com/itm/405536531621,https://i.ebayimg.com/images/g/Z64AAOSw~NdnoWab/s-l140.jpg,"Sold  Feb 17, 2025"
"Belgrade, Montana Yellowstone Geyser Harley Poker Chip / Metallic Blue ","188,645.00 VND",https://www.ebay.com/itm/226590802770,https://i.ebayimg.com/images/g/A0cAAOSwsI5mVo69/s-l140.jpg,"Sold  Feb 17, 2025"
"New Zealand 1960-6 Definitives - Tasman Glacier 10/- & Pohutu Geyser £1, used","106,744.45 VND",https://www.ebay.com/itm/405241340044,https://i.ebayimg.com/images/g/m3gAAOSwwgJm7gF0/s-l140.jpg,"Sold  Feb 17, 2025"
Carleton  Watkins 1880s Stereoview Geyser Canon From The Hotel Sonoma Co CA 2312,"1,795,380.00 VND",https://www.ebay.com/itm/396196786383,https://i.ebayimg.com/images/g/6ZQAAOSwYKZnqjg9/s-l140.jpg,"Sold  Feb 17, 2025"
GEOLOGY HOT WATER GEYSER S/S 1993 NEW ZEALAND FDC,"65,050.00 VND",https://www.ebay.com/itm/304850514402,https://i.ebayimg.com/images/g/EX8AAOSwGCRj7LQn/s-l140.jpg,"Sold  Feb 17, 2025"
SPORT HANDBALL CHAMPIONSHIPS GEYSER VOLCANO 1995 ICELAND FDC,"117,090.00 VND",https://www.ebay.com/itm/305881623783,https://i.ebayimg.com/images/g/JK0AAOSwsExnFNRQ/s-l140.jpg,"Sold  Feb 17, 2025"
"US FDC # 4059 39c Wonders Steamboat Geyser  ArtCraft  2006, 9p7544","32,525.00 VND",https://www.ebay.com/itm/167318938247,https://i.ebayimg.com/images/g/ULMAAeSwqwZnsWfa/s-l140.jpg,"Sold  Feb 17, 2025"
Largest Geyser In California & Geyser At Race Track Calistoga California,"130,100.00 VND",https://www.ebay.com/itm/235951747147,https://i.ebayimg.com/images/g/6IwAAOSw6jlnqYz~/s-l140.jpg,"Sold  Feb 16, 2025"
Samuel & Sons - Celine Ombre Brush Fringe / Color Geyser - 1 yard,"650,500.00 VND",https://www.ebay.com/itm/387955507633,https://i.ebayimg.com/images/g/vGsAAOSwQqVnsnYr/s-l140.jpg,"Sold  Feb 16, 2025"
Eileen Fisher Gray Organic Linen Lantern Pull On Ankle Zip Cargo Pants Geyser M,"701,239.00 VND",https://www.ebay.com/itm/356494546594,https://i.ebayimg.com/images/g/URoAAOSwlqdniNFg/s-l140.jpg,"Sold  Feb 16, 2025"
Zombicide Undead or Alive Dead West KS Promo Abomination - Gore Geyser,"260,200.00 VND",https://www.ebay.com/itm/305730698114,https://i.ebayimg.com/images/g/JAQAAOSwdGRmvnbD/s-l140.jpg,"Sold  Feb 16, 2025"
VINTAGE GEYSER SODA SPRINGS NATURAL MINERAL WATER BOTTLE LIGHT TURQUOISE COLOR,"253,695.00 VND",https://www.ebay.com/itm/276854716508,https://i.ebayimg.com/images/g/6QcAAOSwe8Znn6Pp/s-l140.jpg,"Sold  Feb 16, 2025"
c1915 YELLOWSTONE NATIONAL PARK WY OLD FAITHFUL GEYSER HAYNES POSTCARD P5155,"173,033.00 VND",https://www.ebay.com/itm/356490126741,https://i.ebayimg.com/images/g/cegAAOSwLTxmkARn/s-l140.jpg,"Sold  Feb 16, 2025"
"Yellowstone National Park, Excelsior Geyser, Series #10094, Vintage Postcard","25,759.80 VND",https://www.ebay.com/itm/405533259810,https://i.ebayimg.com/images/g/eTIAAOSwuGJnpo3N/s-l140.jpg,"Sold  Feb 16, 2025"
Crystal Geyser Alpine Spring Water 1 Gal Bottle 6/Case 48 Cases/Pallet 12514,"14,018,535.20 VND",https://www.ebay.com/itm/205208004949,https://i.ebayimg.com/images/g/2EEAAOSwB69nezyW/s-l140.jpg,"Sold  Feb 16, 2025"
Vintage Yellowstone National Park Geyser Travel Souvenir Pin,"280,755.80 VND",https://www.ebay.com/itm/167316958410,https://i.ebayimg.com/images/g/BXcAAOSwTlZnr~Zf/s-l140.jpg,"Sold  Feb 16, 2025"
8mm Home Movie Yellowstone 1972 Geysers Animals Stage Coach,"442,079.80 VND",https://www.ebay.com/itm/267124357839,https://i.ebayimg.com/images/g/6NgAAOSwIitlgwcz/s-l140.jpg,"Sold  Feb 16, 2025"
Vintage Grain Belt - Pilsner Beer Glass EUC - Geyser,"233,919.80 VND",https://www.ebay.com/itm/225271825043,https://i.ebayimg.com/images/g/c4QAAOSw1RVjhA27/s-l140.jpg,"Sold  Feb 15, 2025"
Geyser Kettle - Serafino Zani - 18/10 Stainless Steel,"2,136,697.35 VND",https://www.ebay.com/itm/326396399909,https://i.ebayimg.com/images/g/DaQAAOSwMmlnfB-e/s-l140.jpg,"Sold  Feb 15, 2025"
2022 Zerocool Jackass Trading Card #s-65 Holo SP 89/100 the toilet geyser,"25,759.80 VND",https://www.ebay.com/itm/387908890769,https://i.ebayimg.com/images/g/cv0AAOSwEPJnnp1a/s-l140.jpg,"Sold  Feb 15, 2025"
CMON - Zombicide Undead or Alive - Kickstarter - Gore Geyser Abomination,"465,339.08 VND",https://www.ebay.com/itm/375531624527,https://i.ebayimg.com/images/g/j3sAAOSwBHpmj6nl/s-l140.jpg,"Sold  Feb 15, 2025"
Old STEREOVIEW - Devil's Canon GEYSERS - Sonoma County CA. -  Watkins,"426,207.60 VND",https://www.ebay.com/itm/316212701032,https://i.ebayimg.com/images/g/QCcAAOSw0tZnp4Z7/s-l140.jpg,"Sold  Feb 15, 2025"
Dr Jim Stamps Postcard Saratoga Springs Island Spouter Geyser Park New York,"6,505.00 VND",https://www.ebay.com/itm/286308840066,https://i.ebayimg.com/images/g/i8oAAOSwp0BnoTZr/s-l140.jpg,"Sold  Feb 14, 2025"
2x Stainless Steel 25mm Air Switch Replaceme Button For Geyser Garbage Disposal,"285,179.20 VND",https://www.ebay.com/itm/334229433787,https://i.ebayimg.com/images/g/xcYAAOSw4J1hnGoN/s-l140.jpg,"Sold  Feb 14, 2025"
Yellowstone National Park WY Grotto Geyser in Eruption Woman c1900s-20s Postcard,"155,859.80 VND",https://www.ebay.com/itm/365392601479,https://i.ebayimg.com/images/g/WrcAAeSwhuRnq8Kc/s-l140.jpg,"Sold  Feb 13, 2025"
Mana Geyser - Commander 2021 MTG Plus Bonus Card!!!,"76,759.00 VND",https://www.ebay.com/itm/156689806683,https://i.ebayimg.com/images/g/TXkAAOSwAnVnqnTi/s-l140.jpg,"Sold  Feb 13, 2025"
Postcard Vintage Roadside Geyser Woodside Utah Nature Wonder Carbonated Water,"52,040.00 VND",https://www.ebay.com/itm/265609916959,https://i.ebayimg.com/images/g/cnIAAOSwz1ZiMolO/s-l140.jpg,"Sold  Feb 12, 2025"
Columbia Youth Size 12 Powderbug Forty Print Winter Boots Geyser/Paisley Purple,"702,279.80 VND",https://www.ebay.com/itm/126695133826,https://i.ebayimg.com/images/g/-NIAAOSwQk5m9wUQ/s-l140.jpg,"Sold  Feb 12, 2025"
"METASTIBNITE specimen * The Geysers, California, Ex. Chet Lemanski Collection","1,717,320.00 VND",https://www.ebay.com/itm/146360291643,https://i.ebayimg.com/images/g/k6oAAOSwpP1nm47P/s-l140.jpg,"Sold  Feb 12, 2025"
PRIVATE MAILING CARD Yellowstone Nat'l Park Geyser NORTHERN PACIFIC RWY PC,"2,367,559.80 VND",https://www.ebay.com/itm/356538830203,https://i.ebayimg.com/images/g/ONsAAeSwROFno~2W/s-l140.jpg,"Sold  Feb 12, 2025"
NEW ZEALAND 1903 PPC OF WHAKAREWAREWA GEYSER USED ½d TO UK,"250,182.30 VND",https://www.ebay.com/itm/196985818837,https://i.ebayimg.com/images/g/0C8AAOSwpm9nnkUh/s-l140.jpg,"Sold  Feb 11, 2025"
Steve Spangler's Geyser Tube Event Pack Science Kit for Classrooms (Pack of 10),"2,539,031.60 VND",https://www.ebay.com/itm/356269683588,https://i.ebayimg.com/images/g/C1MAAOSwz01nOUyj/s-l140.jpg,"Sold  Feb 11, 2025"
Mana Geyser x1 - Conspiracy - MTG - Near Mint ,"69,660.13 VND",https://www.ebay.com/itm/223962286387,https://i.ebayimg.com/images/g/xpUAAOSw0~5go-i4/s-l140.jpg,"Sold  Feb 9, 2025"
XCVI WEARABLES Women's Geyser Crop In Tan Ruched Stretch Waist Size Med,"650,500.00 VND",https://www.ebay.com/itm/235951509486,https://i.ebayimg.com/images/g/4G0AAOSw32pnoBNv/s-l140.jpg,"Sold  Feb 9, 2025"
Yellowstone National Park Lower Geyser Basin Fountain Paint Pot Postcard Old PC,"13,010.00 VND",https://www.ebay.com/itm/365371696463,https://i.ebayimg.com/images/g/8yEAAOSwgmVnnCBJ/s-l140.jpg,"Sold  Feb 9, 2025"
Vtg 1950s Grain Belt Geyser 13” Metal Beer Serving Metal Tray Brewing Minnesota ,"325,250.00 VND",https://www.ebay.com/itm/235937724475,https://i.ebayimg.com/images/g/bbMAAOSwhMNneEBP/s-l140.jpg,"Sold  Feb 9, 2025"
Hawaii HI Honolulu Blow Hole Geyser Oahu Postcard Old Vintage Card View Standard,"13,010.00 VND",https://www.ebay.com/itm/365371684613,https://i.ebayimg.com/images/g/97cAAOSwM0FnnB3n/s-l140.jpg,"Sold  Feb 9, 2025"
McDonald’s Happy Meal Toy Disneys Brother Bear Koda On Geyser #4 New 2003,"180,058.40 VND",https://www.ebay.com/itm/285923903396,https://i.ebayimg.com/images/g/Fq0AAOSwmxRmd4Y4/s-l140.jpg,"Sold  Feb 9, 2025"
58 Haynes Yellowstone National Park Cards 3.5” x 2.5” Bears Buffalo Geyser Deer,"519,099.00 VND",https://www.ebay.com/itm/306002453938,https://i.ebayimg.com/images/g/AdkAAOSw-MNnbzqj/s-l140.jpg,"Sold  Feb 9, 2025"
2022 Bitcoin Trading Cards Series 1 Resources Geyser #62 11vc,"125,936.80 VND",https://www.ebay.com/itm/235948147779,https://i.ebayimg.com/images/g/SBYAAeSwXFJnpj8p/s-l140.jpg,"Sold  Feb 8, 2025"
Pluton Creek Geysers Sonoma CA California Andrew Price Stereoview c1880,"4,696,610.00 VND",https://www.ebay.com/itm/387882143185,https://i.ebayimg.com/images/g/xjoAAOSwp5Znnon8/s-l140.jpg,"Sold  Feb 8, 2025"
Cloverdale Road to Geyser Springs CA California Andrew Price Stereoview c1880,"3,903,000.00 VND",https://www.ebay.com/itm/387882142548,https://i.ebayimg.com/images/g/-VoAAOSw4jhnnom6/s-l140.jpg,"Sold  Feb 8, 2025"
Splendid Geyser in Eruption Yellowstone National Park T.W. Ingersoll Stereoview,"312,240.00 VND",https://www.ebay.com/itm/387881938473,https://i.ebayimg.com/images/g/VGwAAOSwMUdnnnL-/s-l140.jpg,"Sold  Feb 8, 2025"
"(65) Yellowstone Slides Color 35mm 1980's Geysers, Bison, Landscapes","520,400.00 VND",https://www.ebay.com/itm/276839236376,https://i.ebayimg.com/images/g/DPoAAOSwzWFnnlRB/s-l140.jpg,"Sold  Feb 8, 2025"
Castle Geyser Yellowstone Park Unposted Postcard - Union Pacific Wyoming,"310,939.00 VND",https://www.ebay.com/itm/226587810266,https://i.ebayimg.com/images/g/VcAAAOSw4G5npw5V/s-l140.jpg,"Sold  Feb 8, 2025"
"Islanda 1939 Mi. 208- Nuovo * MH 100% pesci, Grande geyser, bandiera","128,201.84 VND",https://www.ebay.com/itm/135501540621,https://i.ebayimg.com/images/g/D98AAOSwjelniSS3/s-l140.jpg,"Sold  Feb 8, 2025"
VAILLANT 114277 GREY SPARE WATER HEATER HANDLE GEYSER MAG IT 19/2 X,"320,504.60 VND",https://www.ebay.com/itm/266410825772,https://i.ebayimg.com/images/g/HScAAOSwQ31lAf6U/s-l140.jpg,"Sold  Feb 8, 2025"
Old Faithful Geyser Yellowstone Chicago Railroad Fair Northern Pacific Horse,"43,973.80 VND",https://www.ebay.com/itm/167301248349,https://i.ebayimg.com/images/g/jQwAAOSwlpNm7dEz/s-l140.jpg,"Sold  Feb 7, 2025"
"Sonoma County CA-California, Cottage and Hotel, the Geysers, Vintage Postcard","20,555.80 VND",https://www.ebay.com/itm/405513511902,https://i.ebayimg.com/images/g/PlgAAOSw2HNnlhJB/s-l140.jpg,"Sold  Feb 7, 2025"
NWT $425 Paul Smith Men’s Geyser Leather Chelsea Boots US Size 12. Yours for?,"7,779,980.00 VND",https://www.ebay.com/itm/326419740180,https://i.ebayimg.com/images/g/9SkAAOSwK8xm9JPS/s-l140.jpg,"Sold  Feb 7, 2025"
ICELAND 208Ac MH 1947 60a Great Geyser Perf 11&1/2 CV$3,"28,882.20 VND",https://www.ebay.com/itm/286220078426,https://i.ebayimg.com/images/g/S0wAAOSwGpNnYgHX/s-l140.jpg,"Sold  Feb 7, 2025"
MANA GEYSER Fifth Dawn MTG Magic the Gathering Cards DJMagic,"77,799.80 VND",https://www.ebay.com/itm/375608533823,https://i.ebayimg.com/images/g/RGoAAOSw15ZmyJHt/s-l140.jpg,"Sold  Feb 7, 2025"
1953 Boca Raton FL Postcard Africa USA Train Tour Ticket Watusi Geyser-MR1,"298,969.80 VND",https://www.ebay.com/itm/116461987561,https://i.ebayimg.com/images/g/t2oAAOSwMcdi51gI/s-l140.jpg,"Sold  Feb 7, 2025"
ICELAND 1938 Sc 208A-B Geyser 50a & 1Kr Mounted Mint #6/135,"65,047.40 VND",https://www.ebay.com/itm/316173694550,https://i.ebayimg.com/images/g/NZEAAOSw2AlnnMMJ/s-l140.jpg,"Sold  Feb 7, 2025"
ICELAND 1938 Sc 203-8A Geyser Used. 40a Very Fine Used #6/134,"65,047.40 VND",https://www.ebay.com/itm/316173692187,https://i.ebayimg.com/images/g/YncAAOSwEcxnnMJo/s-l140.jpg,"Sold  Feb 7, 2025"
Mtg Fifth Dawn Mana Geyser French NM,"28,489.30 VND",https://www.ebay.com/itm/134916370636,https://i.ebayimg.com/images/g/0-8AAOSwEFZlu92z/s-l140.jpg,"Sold  Feb 6, 2025"
Vintage Yellowstone Park Metal Drink Coasters OLD FAITHFUL GEYSER made in Japan,"364,280.00 VND",https://www.ebay.com/itm/365377885062,https://i.ebayimg.com/images/g/36gAAOSwF3tnoX1M/s-l140.jpg,"Sold  Feb 7, 2025"
Pair Of F Jay Haynes Photo Art Prints Norris Geyser Basin  & Gibbon Falls 1930's,"462,375.40 VND",https://www.ebay.com/itm/167045302843,https://i.ebayimg.com/images/g/7j4AAOSwwcJekJLL/s-l140.jpg,"Sold  Feb 6, 2025"
"WYOMING,Old Faithful Geyser Yellowstone Nat Pk-#1116a Keystone from 600/1200 Set","128,799.00 VND",https://www.ebay.com/itm/166567626163,https://i.ebayimg.com/images/g/WewAAOSwyNpkSVyQ/s-l140.jpg,"Sold  Feb 6, 2025"
1938-48 Iceland Great Geyser and Hekla stamps,"61,711.63 VND",https://www.ebay.com/itm/135515402191,https://i.ebayimg.com/images/g/RFsAAOSwbP1nk6FF/s-l140.jpg,"Sold  Feb 5, 2025"
Yellowstone Coasters by Hidden Cove Pottery porcelain Six Pieces Bears Geyser,"1,169,078.60 VND",https://www.ebay.com/itm/256803239490,https://i.ebayimg.com/images/g/c5cAAOSwWRNnJxYF/s-l140.jpg,"Sold  Feb 4, 2025"
Yellowstone Geyser FOUND PHOTOGRAPH Color FREE SHIPPING Original VINTAGE 93 4 B,"72,856.00 VND",https://www.ebay.com/itm/186927417676,https://i.ebayimg.com/images/g/~isAAOSww4JcgY0p/s-l140.jpg,"Sold  Feb 3, 2025"
Falls of Yellowstone National Park & Old Faithful Geyser - Antique Print - 1905,"333,242.82 VND",https://www.ebay.com/itm/256788232286,https://i.ebayimg.com/images/g/RkMAAOSwzvNnjOjE/s-l140.jpg,"Sold  Feb 3, 2025"
🔥RARE!🔥 Parks Projects UO EXCLUSIVE Yellowstone Geysers Trail High Pile Fleece,"3,381,299.00 VND",https://www.ebay.com/itm/145869425810,https://i.ebayimg.com/images/g/j3kAAOSwEwFmha37/s-l140.jpg,"Sold  Feb 3, 2025"
Volcanic Geyser Core Set 2021 MTG - NM+,"27,060.80 VND",https://www.ebay.com/itm/126420311064,https://i.ebayimg.com/images/g/Y8AAAOSwqLxmFKNY/s-l140.jpg,"Sold  Feb 2, 2025"
Antique Orig  F. Jay Haynes Cabinet Card #-4171-RIVERSIDE GEYSER,"2,732,100.00 VND",https://www.ebay.com/itm/267111702170,https://i.ebayimg.com/images/g/uL4AAOSwfL1ndEec/s-l140.jpg,"Sold  Feb 2, 2025"
Wyoming WY Yellowstone National Park Old Faithful Geyser Union Pacific Postcard,"13,010.00 VND",https://www.ebay.com/itm/365360379956,https://i.ebayimg.com/images/g/fYgAAOSwS4BnkqaS/s-l140.jpg,"Sold  Feb 2, 2025"
Yellowstone Geysers by Collectible - Good,"1,691,300.00 VND",https://www.ebay.com/itm/284659665967,https://i.ebayimg.com/images/g/rhUAAOSw3n1iD~gO/s-l140.jpg,"Sold  Feb 2, 2025"
Magic the Gathering MTG Fifth Dawn MANA GEYSER Chinese,"45,535.00 VND",https://www.ebay.com/itm/204277355551,https://i.ebayimg.com/images/g/CNMAAOSw1TFkFQGj/s-l140.jpg,"Sold  Feb 1, 2025"
"Vintage Picture Postcard Of ""The Riverside Geyser"" Over Firehole River. #-2306","76,759.00 VND",https://www.ebay.com/itm/394813937866,https://i.ebayimg.com/images/g/vKEAAOSwWfNk2rlB/s-l140.jpg,"Sold  Feb 1, 2025"
Tory Burch Fleming Small Convertible Shoulder Bag. Geyser. BNWT,"12,489,600.00 VND",https://www.ebay.com/itm/316133740600,https://i.ebayimg.com/images/g/3cQAAOSwZd1nhrEN/s-l140.jpg,"Sold  Feb 1, 2025"
Sorcery ALPHA Exceptional FOIL - GEYSER - COMBINE SHIP Pre Beta,"247,190.00 VND",https://www.ebay.com/itm/205246661932,https://i.ebayimg.com/images/g/1B8AAOSwXetnlWm0/s-l140.jpg,"Sold  Feb 1, 2025"
Watkins Pacific Coast Indian Sweat Bath Geysers Sonoma California CA Stereoview,"2,029,560.00 VND",https://www.ebay.com/itm/387859421128,https://i.ebayimg.com/images/g/GUYAAOSw3L1nlXfE/s-l140.jpg,"Sold  Feb 1, 2025"
GEYSER REEF MOZAMBIQUE 5000 FRANCS 2024 WHALE SHARK MANTA RAY & SHIP GEYSIR 36mm,"780,600.00 VND",https://www.ebay.com/itm/276484091789,https://i.ebayimg.com/images/g/K58AAOSwDwFmV3hb/s-l140.jpg,"Sold  Feb 1, 2025"
"New Zealand 1967 Pohutu Geyser $2, fine used with plate margin","130,094.80 VND",https://www.ebay.com/itm/404962599774,https://i.ebayimg.com/images/g/2t8AAOSwCy5mOWE5/s-l140.jpg,"Sold  Feb 1, 2025"
Manitou CO-Colorado Iron Springs Geyser Vintage Postcard Standard Souvenir PC,"20,555.80 VND",https://www.ebay.com/itm/405493841569,https://i.ebayimg.com/images/g/S34AAOSwRXpnkFll/s-l140.jpg,"Sold  Jan 31, 2025"
LONE STAR GEYSER YELLOWSTONE NAT. PARK * People Horses Carriage not posted,"1,123,283.40 VND",https://www.ebay.com/itm/356507570427,https://i.ebayimg.com/images/g/KfUAAOSw0Rhnlq8G/s-l140.jpg,"Sold  Jan 31, 2025"
Topps Womens UCL Knockout 2022-23 - Geyse Ferreira 71/99 Barcelona,"200,145.84 VND",https://www.ebay.com/itm/396011789460,https://i.ebayimg.com/images/g/1EoAAOSwZCtnXg5t/s-l140.jpg,"Sold  Jan 31, 2025"
UGG Abela Geyser Suede Fur Slippers Womens Size 8 *NIB*,"1,429,799.00 VND",https://www.ebay.com/itm/304142895655,https://i.ebayimg.com/images/g/7SoAAOSw4JphPSEl/s-l140.jpg,"Sold  Jan 31, 2025"
Mana Geyser Foil - Secret Lair SLD Extra Life Pixel Perfect,"155,599.60 VND",https://www.ebay.com/itm/276697655009,https://i.ebayimg.com/images/g/DWkAAOSwmihnGAfn/s-l140.jpg,"Sold  Jan 31, 2025"
The Giant Geyser Yellowstone National Park #8123 - 1913 Postcard,"141,809.00 VND",https://www.ebay.com/itm/235881556794,https://i.ebayimg.com/images/g/BKAAAOSwygVnaLeF/s-l140.jpg,"Sold  Jan 31, 2025"
VTG Yellowstone National Park Old Faithful Geyser Ceramic Salt & Pepper Shakers,"110,585.00 VND",https://www.ebay.com/itm/204571030718,https://i.ebayimg.com/images/g/1coAAOSwgCNlcg5A/s-l140.jpg,"Sold  Jan 31, 2025"
"60:-Andrew's Geyser by Moonlight, ""In the Land of the Sky” Postcard UNP ","104,080.00 VND",https://www.ebay.com/itm/356518090817,https://i.ebayimg.com/images/g/ek0AAOSwf6Vnm0gr/s-l140.jpg,"Sold  Jan 30, 2025"
Park Projects Unisex Yellowstone Geysers Beanie Hat One Size NWOT,"780,339.80 VND",https://www.ebay.com/itm/146341728989,https://i.ebayimg.com/images/g/qJAAAOSwmMNnZviM/s-l140.jpg,"Sold  Jan 30, 2025"
G1489~ CALIFORNIA – GEYSER HOTEL Sonoma Co. c1870s Stereoview - Houseworth,"1,691,300.00 VND",https://www.ebay.com/itm/205234787573,https://i.ebayimg.com/images/g/fwoAAOSwKuJnXykI/s-l140.jpg,"Sold  Jan 30, 2025"
Geyser Drake - Foil - Magic MTG 2024 Outlaws of Thunder Junction - NM/M,"38,769.80 VND",https://www.ebay.com/itm/335373238636,https://i.ebayimg.com/images/g/nwsAAOSwgtFmMcLA/s-l140.jpg,"Sold  Jan 29, 2025"
OLD FAITHFUL GEYSER - YELLOWSTONE NATIONAL PARK WYOMING ZINC PRESSED PENNY,"156,120.00 VND",https://www.ebay.com/itm/135522602177,https://i.ebayimg.com/images/g/wbYAAOSwlwNnmTRv/s-l140.jpg,"Sold  Jan 29, 2025"
MTG The List° Mana Geyser,260.20 VND,https://www.ebay.com/itm/167271474189,https://i.ebayimg.com/images/g/99gAAOSwK9Nnky3m/s-l140.jpg,"Sold  Jan 28, 2025"
"Rotorua New Zealand, Waimungu Geyser, Antique, Souvenir, Vintage Postcard","40,591.20 VND",https://www.ebay.com/itm/405486786854,https://i.ebayimg.com/images/g/fMAAAOSwtspnLClE/s-l140.jpg,"Sold  Jan 28, 2025"
