Title,Price,Link,Image Link,Sold Date
"Yellowstone National Park, WY Wyoming old Postcard, Lone Star Geyser","585,450.00 VND",https://www.ebay.com/itm/376064324863,https://i.ebayimg.com/images/g/sioAAOSwb7Jn0jDb/s-l140.jpg,"Sold  Mar 19, 2025"
"Yellowstone National Park, WY Wyoming old Postcard, Excelsior Geyser","533,410.00 VND",https://www.ebay.com/itm/376064318074,https://i.ebayimg.com/images/g/S1IAAOSwsjRn0jAJ/s-l140.jpg,"Sold  Mar 19, 2025"
"Yellowstone National Park, WY Wyoming old Postcard, Grotto Geyser","651,801.00 VND",https://www.ebay.com/itm/226643790241,https://i.ebayimg.com/images/g/ErQAAOSw9mRn0i7w/s-l140.jpg,"Sold  Mar 19, 2025"
"Yellowstone National Park, WY Wyoming old Postcard, Old Faithful Geyser","637,490.00 VND",https://www.ebay.com/itm/376064310672,https://i.ebayimg.com/images/g/9rAAAOSwhY1n0i5m/s-l140.jpg,"Sold  Mar 19, 2025"
"Yellowstone National Park, WY Wyoming old Postcard, Castle Geyser","533,410.00 VND",https://www.ebay.com/itm/376064308265,https://i.ebayimg.com/images/g/1CUAAOSwTbBn0i4J/s-l140.jpg,"Sold  Mar 19, 2025"
"Yellowstone National Park, WY Wyoming old Postcard, The Lone Star Geyser","559,430.00 VND",https://www.ebay.com/itm/376016845696,https://i.ebayimg.com/images/g/bU0AAOSwmEVnupzx/s-l140.jpg,"Sold  Mar 1, 2025"
"Yellowstone National Park, WY Wyoming old Postcard, Grotto Geyser","806,620.00 VND",https://www.ebay.com/itm/226579371310,https://i.ebayimg.com/images/g/Ya4AAOSw7zZnoEt3/s-l140.jpg,"Sold  Feb 9, 2025"
Oblong Geyser Crater Yellowstone National Park Linen Postcard,"58,545.00 VND",https://www.ebay.com/itm/326114174603,https://i.ebayimg.com/images/g/tooAAOSwbt9mNjR5/s-l140.jpg,"Sold  Mar 19, 2025"
Oblong Geyser Crater Yellowstone Nat l Park WB 1920s Postcard JH15,"65,050.00 VND",https://www.ebay.com/itm/205119006264,https://i.ebayimg.com/images/g/figAAOSwbqpnPwJv/s-l140.jpg,"Sold  Jan 11, 2025"
Allbirds Tree Dasher Mens Size 9.5 TD Shoes Geyser Gray Athletic Running Sneaker,"1,040,539.80 VND",https://www.ebay.com/itm/226643833164,https://i.ebayimg.com/images/g/iD0AAeSwkZ1n0jQQ/s-l140.jpg,"Sold  Mar 18, 2025"
Allbirds Tree Dasher Mens Size 11 Shoes Geyser Gray Athletic Running Sneakers,"910,700.00 VND",https://www.ebay.com/itm/146342772117,https://i.ebayimg.com/images/g/FkkAAOSwn~pnjyLG/s-l140.jpg,"Sold  Feb 24, 2025"
Yellowstone National Park Old Faithful Geyser Souvenir Pinback Pin Badge,"259,939.80 VND",https://www.ebay.com/itm/256829891479,https://i.ebayimg.com/images/g/28cAAOSwOtFnu4OW/s-l140.jpg,"Sold  Mar 17, 2025"
Yellowstone National Park Old Faithful Geyser Fact Travel Souvenir Pin,"520,139.80 VND",https://www.ebay.com/itm/387846253198,https://i.ebayimg.com/images/g/BK8AAOSwr1xnJGLE/s-l140.jpg,"Sold  Jan 22, 2025"
Yellowstone National Park Old Faithful Geyser Postcard Old Vintage Card View PC,"46,836.00 VND",https://www.ebay.com/itm/316457439280,https://i.ebayimg.com/images/g/8sIAAOSwjh1nynSC/s-l140.jpg,"Sold  Mar 16, 2025"
Yellowstone National Park Grotto Geyser Postcard Old Vintage Card View Standard,"13,010.00 VND",https://www.ebay.com/itm/365444767828,https://i.ebayimg.com/images/g/SscAAOSwojVnynGh/s-l140.jpg,"Sold  Mar 16, 2025"
Yellowstone National Park Old Faithful Geyser Postcard Old Vintage Card View PC,"13,010.00 VND",https://www.ebay.com/itm/365444241339,https://i.ebayimg.com/images/g/CNAAAOSwlyFnyh6w/s-l140.jpg,"Sold  Mar 16, 2025"
Yellowstone National Park Old Faithful Geyser Postcard Old Vintage Card View PC,"13,010.00 VND",https://www.ebay.com/itm/365429639360,https://i.ebayimg.com/images/g/o-UAAOSw3ABnwQ7e/s-l140.jpg,"Sold  Mar 9, 2025"
Yellowstone National Park Old Faithful Inn Geyser Basin Postcard Old Vintage PC,"13,010.00 VND",https://www.ebay.com/itm/316404089931,https://i.ebayimg.com/images/g/060AAOSwhzlnwQxG/s-l140.jpg,"Sold  Mar 9, 2025"
Yellowstone National Park Riverside Geyser Postcard Old Vintage Card View Postal,"13,010.00 VND",https://www.ebay.com/itm/365412752718,https://i.ebayimg.com/images/g/KpUAAOSwdrNnt-n9/s-l140.jpg,"Sold  Mar 2, 2025"
Yellowstone National Old Faithful Geyser Postcard Old Vintage Card View Standard,"13,010.00 VND",https://www.ebay.com/itm/365412219846,https://i.ebayimg.com/images/g/yWQAAOSwXr1nt6YX/s-l140.jpg,"Sold  Mar 2, 2025"
Yellowstone National Park Old Faithful Geyser Postcard Old Vintage Card View PC,"13,010.00 VND",https://www.ebay.com/itm/135552395858,https://i.ebayimg.com/images/g/kuoAAOSwR5Znrkos/s-l140.jpg,"Sold  Feb 23, 2025"
Yellowstone National Park Old Faithful Geyser Postcard Old Vintage Card View PC,"24,198.60 VND",https://www.ebay.com/itm/365382670306,https://i.ebayimg.com/images/g/RwwAAOSwNrdnpULV/s-l140.jpg,"Sold  Feb 16, 2025"
Yellowstone National Park Old Faithful Geyser Postcard Old Vintage Card View PC,"52,040.00 VND",https://www.ebay.com/itm/135526237460,https://i.ebayimg.com/images/g/df4AAOSwQR9nnANN/s-l140.jpg,"Sold  Feb 9, 2025"
Yellowstone National Park Old Faithful Geyser Postcard Old Vintage Card View PC,"28,882.20 VND",https://www.ebay.com/itm/316121125978,https://i.ebayimg.com/images/g/868AAOSwGApngEfL/s-l140.jpg,"Sold  Jan 19, 2025"
Yellowstone National Park Grand Geyser Postcard Old Vintage Card View Standard,"13,010.00 VND",https://www.ebay.com/itm/316101437594,https://i.ebayimg.com/images/g/KjwAAOSwO6pndv34/s-l140.jpg,"Sold  Jan 12, 2025"
Yellowstone National Park Old Faithful Geyser Postcard Old Vintage Card View PC,"13,010.00 VND",https://www.ebay.com/itm/365319847240,https://i.ebayimg.com/images/g/v8MAAOSwE3tnduzK/s-l140.jpg,"Sold  Jan 12, 2025"
Yellowstone CASTLE GEYSER 1900 Detroit Photographic 121 PMC Postcard W697,"520,139.80 VND",https://www.ebay.com/itm/376074526871,https://i.ebayimg.com/images/g/5OEAAeSwrrFn1xAy/s-l140.jpg,"Sold  Mar 16, 2025"
Yellowstone NORRIS GEYSER BASIN 1898 Detroit Photographic PMC Postcard W699,"520,139.80 VND",https://www.ebay.com/itm/376074526867,https://i.ebayimg.com/images/g/efEAAeSwnP9n1xAV/s-l140.jpg,"Sold  Mar 16, 2025"
"Grotto Geyser-Yellowstone Park, Wyoming","41,371.80 VND",https://www.ebay.com/itm/335013724591,https://i.ebayimg.com/images/g/LrUAAOSwU-hk80Uh/s-l140.jpg,"Sold  Mar 16, 2025"
"Grotto Geyser-Yellowstone National Park, Wyoming","41,371.80 VND",https://www.ebay.com/itm/335075603968,https://i.ebayimg.com/images/g/UGwAAOSwcTxlLp8Q/s-l140.jpg,"Sold  Mar 16, 2025"
Icelandic Views Cards Set 1934 Liebig Iceland Glaciers Geyser Waterfall Geology,"166,454.62 VND",https://www.ebay.com/itm/135610282115,https://i.ebayimg.com/images/g/mPgAAOSwlItnyxbp/s-l140.jpg,"Sold  Mar 16, 2025"
Icelandic Views Cards Set 1934 Liebig Iceland Glaciers Geyser Waterfall Geology,"166,454.62 VND",https://www.ebay.com/itm/135056309370,https://i.ebayimg.com/images/g/lzcAAOSw239mM42U/s-l140.jpg,"Sold  Mar 7, 2025"
Froggys Fog Quikblast 4 Gallon case perfect for geyser rgb CO2 effect fog,"3,122,139.80 VND",https://www.ebay.com/itm/133838667274,https://i.ebayimg.com/images/g/ii4AAOSwyexhCpho/s-l140.jpg,"Sold  Mar 15, 2025"
Froggys Fog Quikblast 1 Gallon  perfect for geyser rgb CO2 effect fog ,"910,439.80 VND",https://www.ebay.com/itm/363492339721,https://i.ebayimg.com/images/g/pDEAAOSwYAddm1sZ/s-l140.jpg,"Sold  Mar 7, 2025"
 POSTCARD CASTLE GEYSER YELLOWSTONE NATIONAL PARK - WYOMING,"136,084.60 VND",https://www.ebay.com/itm/124809961607,https://i.ebayimg.com/images/g/XiAAAOSw~~pg15a7/s-l140.jpg,"Sold  Mar 15, 2025"
LINEN UNPOSTED POSTCARD CASTLE GEYSER YELLOWSTONE NATIONAL PARK,"55,162.40 VND",https://www.ebay.com/itm/156620766843,https://i.ebayimg.com/images/g/YXMAAOSwjatncDl5/s-l140.jpg,"Sold  Jan 12, 2025"
Ink Geyser - Disney Lorcana Archazia's Island Rare 119/204 Mint,"52,040.00 VND",https://www.ebay.com/itm/197105625775,https://i.ebayimg.com/images/g/MGwAAeSwU99n0PpS/s-l140.jpg,"Sold  Mar 14, 2025"
Ink Geyser - Disney Lorcana Archazia's Island Rare 119/204 Mint,"52,040.00 VND",https://www.ebay.com/itm/197099513630,https://i.ebayimg.com/images/g/MGwAAeSwU99n0PpS/s-l140.jpg,"Sold  Mar 12, 2025"
LINEN UNPOSTED POSTCARD AT NORRIS GEYSER BASIN YELLOWSTONE NATIONAL PARK,"9,107.00 VND",https://www.ebay.com/itm/156757639955,https://i.ebayimg.com/images/g/gLcAAOSwJf5nufCt/s-l140.jpg,"Sold  Mar 10, 2025"
LINEN UNPOSTED POSTCARD CASTLE GEYSER YELLOWSTONE NATONAL PARK,"33,045.40 VND",https://www.ebay.com/itm/156729866613,https://i.ebayimg.com/images/g/yewAAOSwFKFnsMUf/s-l140.jpg,"Sold  Mar 2, 2025"
LINEN UNPOSTED POSTCARD GROTTO GEYSER YELLOWSTONE NATIONAL PARK,"78,060.00 VND",https://www.ebay.com/itm/156726771812,https://i.ebayimg.com/images/g/ObEAAOSwfKhnsMR9/s-l140.jpg,"Sold  Mar 1, 2025"
Grotto Geyser Cone Upper Basin Yellowstone Park E.F. Everitt Stereoview c1880,"728,560.00 VND",https://www.ebay.com/itm/388019327831,https://i.ebayimg.com/images/g/Qv0AAOSwJQJnw66C/s-l140.jpg,"Sold  Mar 8, 2025"
Grotto Geyser Cone Upper Basin Yellowstone Park N.A. Forsyth Stereoview,"1,170,900.00 VND",https://www.ebay.com/itm/387821064420,https://i.ebayimg.com/images/g/q-wAAOSwAWZnebJz/s-l140.jpg,"Sold  Feb 24, 2025"
YELLOWSTONE PARK-BEEHIVE GEYSER-200FT-#10104-W/B-HAYNES(#178),"129,839.80 VND",https://www.ebay.com/itm/375752808649,https://i.ebayimg.com/images/g/KFYAAOSw2TtnIn6D/s-l140.jpg,"Sold  Mar 7, 2025"
YELLOWSTONE PARK-GRAND GEYSER 200FT.-#10154-W/B-HAYNES(#190*),"129,839.80 VND",https://www.ebay.com/itm/375757359511,https://i.ebayimg.com/images/g/poIAAOSwPEtnJN6c/s-l140.jpg,"Sold  Mar 7, 2025"
YELLOWSTONE PARK-HAYNES-RIVERSIDE GEYSER-#R54126-TYPE D-#123-(#64),"311,979.80 VND",https://www.ebay.com/itm/387537404727,https://i.ebayimg.com/images/g/EtMAAOSwXEVnG-MT/s-l140.jpg,"Sold  Mar 7, 2025"
RARE-YELLOWSTONE PARK-HAYNES-RIVERSIDE GEYSER-#123-TYPE A-(#19),"1,040,539.80 VND",https://www.ebay.com/itm/375730595255,https://i.ebayimg.com/images/g/OhMAAOSwFQxnFpj4/s-l140.jpg,"Sold  Jan 17, 2025"
SIMER Geyser II Model 2305 1/4 HP 120V AC Thermoplastic Submersible Utility Pump,"1,691,300.00 VND",https://www.ebay.com/itm/176872145804,https://i.ebayimg.com/images/g/ymAAAeSwsp1nvPT2/s-l140.jpg,"Sold  Mar 4, 2025"
SIMER Geyser II Model 2305 1/4 HP 120V AC Thermoplastic Submersible Utility Pump,"2,341,539.80 VND",https://www.ebay.com/itm/326300156820,https://i.ebayimg.com/images/g/w6QAAOSwVZRnCVEU/s-l140.jpg,"Sold  Jan 13, 2025"
Postcard: 10100 OBLONG GEYSER CRATER. YELLOWSTONE NATIONAL PARK HAYNES,"117,090.00 VND",https://www.ebay.com/itm/396192524558,https://i.ebayimg.com/images/g/qcEAAeSwRj9nqMIh/s-l140.jpg,"Sold  Mar 4, 2025"
Postcard: 10098 GIANT GEYSER CONE. YELLOWSTONE NATIONAL PARK HAYNES,"117,090.00 VND",https://www.ebay.com/itm/396198092685,https://i.ebayimg.com/images/g/ukkAAeSwVetnqsAb/s-l140.jpg,"Sold  Mar 2, 2025"
"Postcard: 13063. GIANT GEYSER-250 FT., YELLOWSTONE NATIONAL PARK. HAYN","117,090.00 VND",https://www.ebay.com/itm/396198092756,https://i.ebayimg.com/images/g/ux8AAeSw2mdnqsC0/s-l140.jpg,"Sold  Mar 2, 2025"
"Postcard: 10154. GRAND GEYSER, 200 FT., YELLOWSTONE NATIONAL PARK. HAY","117,090.00 VND",https://www.ebay.com/itm/396160179547,https://i.ebayimg.com/images/g/SVQAAeSwdwBnmmYT/s-l140.jpg,"Sold  Mar 2, 2025"
"Postcard: 10378 OLD FAITHFUL GEYSER-150 FT., YELLOWSTONE PARK HAYNES","117,090.00 VND",https://www.ebay.com/itm/396167063956,https://i.ebayimg.com/images/g/drIAAOSwR3NnnjP5/s-l140.jpg,"Sold  Mar 2, 2025"
"Postcard: 13040 OLD FAITHFUL GEYSER, 150 FT., YELLOWSTONE PARK HAYNES","117,090.00 VND",https://www.ebay.com/itm/396198092805,https://i.ebayimg.com/images/g/0CQAAeSwDiFnqsC~/s-l140.jpg,"Sold  Mar 2, 2025"
Panini Women’s Super League 2025 - Geyse - Stat Smasher Manchester United No.339,"41,697.05 VND",https://www.ebay.com/itm/196918127582,https://i.ebayimg.com/images/g/t1sAAOSwmjZncUb3/s-l140.jpg,"Sold  Feb 28, 2025"
Panini Women’s Super League 2025 - Geyse Manchester United No. 327,"41,697.05 VND",https://www.ebay.com/itm/196918127570,https://i.ebayimg.com/images/g/Xj4AAOSw7uxncUbR/s-l140.jpg,"Sold  Feb 2, 2025"
C23 Glass Magic Lantern Slide YELLOWSTONE OLD FAITHFUL GEYSER,"560,991.20 VND",https://www.ebay.com/itm/267157926074,https://i.ebayimg.com/images/g/bX4AAOSwI~9lGCgV/s-l140.jpg,"Sold  Feb 26, 2025"
B56 Glass Magic Lantern Slide YELLOWSTONE OLD FAITHFUL GEYSER,"336,698.80 VND",https://www.ebay.com/itm/256813393802,https://i.ebayimg.com/images/g/y6IAAOSweRJlGAt6/s-l140.jpg,"Sold  Feb 25, 2025"
Grand Geyser Playing 200ft High Yellowstone Park N.A. Forsyth Stereoview,"1,170,900.00 VND",https://www.ebay.com/itm/387821064425,https://i.ebayimg.com/images/g/RywAAOSw~bxnebMj/s-l140.jpg,"Sold  Feb 24, 2025"
Great Fountain Geyser in Action Yellowstone Park N.A. Forsyth Stereoview,"780,600.00 VND",https://www.ebay.com/itm/387793330123,https://i.ebayimg.com/images/g/-IkAAOSw-iRnebJP/s-l140.jpg,"Sold  Jan 11, 2025"
✨Micro Machines 1997 Exploration Earth Big Blast Geyser 66366✨,"1,821,139.80 VND",https://www.ebay.com/itm/225270249181,https://i.ebayimg.com/images/g/Cv4AAOSwhvpi3ZlC/s-l140.jpg,"Sold  Feb 22, 2025"
Micro Machines Exploration Earth Big Blast Geyser 1997 Galoob #66366,"598,199.80 VND",https://www.ebay.com/itm/226509155092,https://i.ebayimg.com/images/g/DzAAAOSwvBVnaLzQ/s-l140.jpg,"Sold  Jan 24, 2025"
Advertising brand GAUTZSCH gas lamps - gas stoves - Geyser (NL),"42,733.95 VND",https://www.ebay.com/itm/186955827811,https://i.ebayimg.com/images/g/iTcAAOSwxjJnsJfG/s-l140.jpg,"Sold  Feb 22, 2025"
Advertising brand GAUTZSCH gas lamps - gas stoves - Geyser (NL),"28,489.30 VND",https://www.ebay.com/itm/186912331481,https://i.ebayimg.com/images/g/i5oAAOSwgCBnlOX-/s-l140.jpg,"Sold  Feb 1, 2025"
2022-23 Topps Chrome Barcelona Geyse Feirrera Rookie RC Team Color 8/99 Brazil,"91,330.20 VND",https://www.ebay.com/itm/365404005172,https://i.ebayimg.com/images/g/Q90AAOSwfW5nspbn/s-l140.jpg,"Sold  Feb 21, 2025"
2022-23 Topps Chrome Barcelona Geyse Feirrera Rookie RC Blue 13/75 Brazil,"101,217.80 VND",https://www.ebay.com/itm/365365553134,https://i.ebayimg.com/images/g/zIwAAOSwkCpnltV7/s-l140.jpg,"Sold  Feb 2, 2025"
NEW ALLBIRDS TREE DASHER GEYSER SNEAKER SHOE LACE UP WHITE BLUE MENS SIZE 11.5,"1,300,739.80 VND",https://www.ebay.com/itm/276842691426,https://i.ebayimg.com/images/g/FnsAAOSwYipnob6U/s-l140.jpg,"Sold  Feb 21, 2025"
NEW ALLBIRDS TREE DASHER GEYSER SNEAKER SHOE LACE UP WHITE BLUE MENS SIZE 9.5,"1,300,739.80 VND",https://www.ebay.com/itm/286300427346,https://i.ebayimg.com/images/g/FnsAAOSwYipnob6U/s-l140.jpg,"Sold  Feb 12, 2025"
NEW ALLBIRDS TREE DASHER GEYSER SNEAKER SHOE LACE UP WHITE BLUE MENS SIZE 10.5,"1,300,739.80 VND",https://www.ebay.com/itm/286300427664,https://i.ebayimg.com/images/g/FnsAAOSwYipnob6U/s-l140.jpg,"Sold  Feb 8, 2025"
Postcard - Yellowstone National Park - Midway Geyser Basin- Unposted,"55,943.00 VND",https://www.ebay.com/itm/374758472899,https://i.ebayimg.com/images/g/njgAAOSwh-Fki49R/s-l140.jpg,"Sold  Feb 19, 2025"
Postcard - Yellowstone National Park - Norris Geyser Basin - Unposted,"55,943.00 VND",https://www.ebay.com/itm/374758472902,https://i.ebayimg.com/images/g/PbIAAOSwHTxki49f/s-l140.jpg,"Sold  Feb 16, 2025"
"Yellowstone Park WY, Excelsior Geyser, Wyoming Vintage Postcard","25,759.80 VND",https://www.ebay.com/itm/405536560640,https://i.ebayimg.com/images/g/H0QAAOSwfp9noZY3/s-l140.jpg,"Sold  Feb 17, 2025"
"Yellowstone Park WY, Center Great Fountain Geyser, Wyoming Vintage Postcard","25,759.80 VND",https://www.ebay.com/itm/405536560536,https://i.ebayimg.com/images/g/KgMAAOSwYMVnoZZt/s-l140.jpg,"Sold  Feb 17, 2025"
"Yellowstone Park, Castle Geyser Blow, Wyoming Vintage Postcard","20,555.80 VND",https://www.ebay.com/itm/405457930486,https://i.ebayimg.com/images/g/2v8AAOSwkpRnLFBK/s-l140.jpg,"Sold  Jan 14, 2025"
NEW HOT WHEELS 2013 HW ROAD TRIPPIN' HIGHWAY 212 GEYSER BASIN TESLA ROADSTER,"25,759.80 VND",https://www.ebay.com/itm/146382181373,https://i.ebayimg.com/images/g/0M8AAOSw939nquQC/s-l140.jpg,"Sold  Feb 15, 2025"
NEW HOT WHEELS 2013 HW ROAD TRIPPIN' HIGHWAY 212 GEYSER BASIN TESLA ROADSTER,"195,150.00 VND",https://www.ebay.com/itm/146322731846,https://i.ebayimg.com/images/g/HV4AAOSwxyNnf3aU/s-l140.jpg,"Sold  Jan 13, 2025"
DR JIM STAMPS EXCELSIOR GEYSER YELLOWSTONE PARK POSTCARD UNDIVIDED BACK,"7,806.00 VND",https://www.ebay.com/itm/405515601442,https://i.ebayimg.com/images/g/9nkAAOSwHiVnmQ82/s-l140.jpg,"Sold  Feb 8, 2025"
DR JIM STAMPS RIVERSIDE GEYSER YELOWSTONE PARK POSTCARD UNDIVIDED BACK,"62,708.20 VND",https://www.ebay.com/itm/405513335856,https://i.ebayimg.com/images/g/aTUAAOSwCr1nmQuZ/s-l140.jpg,"Sold  Feb 7, 2025"
ICELAND 208 SG231 MH 1938-47 50a Great Geyser CV$21,"160,543.40 VND",https://www.ebay.com/itm/275875243303,https://i.ebayimg.com/images/g/AgkAAOSwyqNkc8uP/s-l140.jpg,"Sold  Feb 7, 2025"
ICELAND 204 SG227 MH 1938-47 20a Great Geyser CV$22,"164,706.60 VND",https://www.ebay.com/itm/286023036610,https://i.ebayimg.com/images/g/vdAAAOSw051mxmU-/s-l140.jpg,"Sold  Feb 7, 2025"
ICELAND 203 SG226 MH 1938-47 15a Great Geyser CV$5,"55,422.60 VND",https://www.ebay.com/itm/276605218563,https://i.ebayimg.com/images/g/z0MAAOSwxy5mxmUC/s-l140.jpg,"Sold  Feb 7, 2025"
ICELAND 206 SG229 MH 1938-47 40a Great Geyser CV$12,"105,381.00 VND",https://www.ebay.com/itm/286023040964,https://i.ebayimg.com/images/g/ZVAAAOSw8vhmxmZo/s-l140.jpg,"Sold  Feb 7, 2025"
Parks Project Unisex Yellowstone Geysers High Pile Fleece Jogger Medium,"1,485,481.80 VND",https://www.ebay.com/itm/135498800544,https://i.ebayimg.com/images/g/iC8AAOSwsUlnhuze/s-l140.jpg,"Sold  Feb 4, 2025"
Parks Project Unisex Yellowstone Geysers High Pile Fleece Jogger Size M,"2,575,980.00 VND",https://www.ebay.com/itm/176427037842,https://i.ebayimg.com/images/g/MDMAAOSw7VRmbnOa/s-l140.jpg,"Sold  Jan 11, 2025"
1932 Postcard Old Faithful Inn & Geyser Yellowstone National Park WY,"123,595.00 VND",https://www.ebay.com/itm/286290503294,https://i.ebayimg.com/images/g/Fs8AAOSw-YlmN-YO/s-l140.jpg,"Sold  Feb 1, 2025"
RPPC Postcard Old Faithful Geyser Yellowstone National Park WY 1950s Unposted,"102,779.00 VND",https://www.ebay.com/itm/355733845893,https://i.ebayimg.com/images/g/IJcAAOSwg1BmRmac/s-l140.jpg,"Sold  Jan 10, 2025"
Vintage R Atkinson Fox Geyser NR,"3,382,600.00 VND",https://www.ebay.com/itm/375963886968,https://i.ebayimg.com/images/g/53cAAOSwZ~dnnrH4/s-l140.jpg,"Sold  Feb 1, 2025"
Vintage R Atkinson Fox Old Faithful Geyser NR,"3,720,860.00 VND",https://www.ebay.com/itm/375949861400,https://i.ebayimg.com/images/g/WvYAAOSwvXVnlQPH/s-l140.jpg,"Sold  Jan 25, 2025"
DR JIM STAMPS POSTCARD GROTTO GEYSER FORMATION YELLOWSTONE UNPOSTED,"32,525.00 VND",https://www.ebay.com/itm/286282921871,https://i.ebayimg.com/images/g/NDoAAOSwtY5nhaPH/s-l140.jpg,"Sold  Jan 31, 2025"
DR JIM STAMPS POSTCARD GRAND GEYSER UPPER BASIN YELLOWSTONE PARK UNPOSTED,"6,505.00 VND",https://www.ebay.com/itm/405490806154,https://i.ebayimg.com/images/g/6GIAAOSwtrtnbV03/s-l140.jpg,"Sold  Jan 27, 2025"
# 195 Haynes Type C Back Yellowstone Beehive Geyser c1920s Postcard 12189b,"360,377.00 VND",https://www.ebay.com/itm/235930926766,https://i.ebayimg.com/images/g/BgkAAOSwsaJnljID/s-l140.jpg,"Sold  Jan 31, 2025"
# 123 Haynes Type C Back Yellowstone Riverside Geyser c1920s Postcard 12187b,"386,397.00 VND",https://www.ebay.com/itm/235930920885,https://i.ebayimg.com/images/g/yYcAAOSwZ~dnljFO/s-l140.jpg,"Sold  Jan 29, 2025"
Postcard Wyoming Old Faithful Geyser at Sunset Yellowstone National Park,"207,899.80 VND",https://www.ebay.com/itm/126485384886,https://i.ebayimg.com/images/g/3aEAAOSw~6hniS4R/s-l140.jpg,"Sold  Jan 30, 2025"
Postcard Wyoming Midway Geyser Basin at Sunset Yellowstone National Park,"207,899.80 VND",https://www.ebay.com/itm/126485641806,https://i.ebayimg.com/images/g/0NQAAOSwS4JmRlkB/s-l140.jpg,"Sold  Jan 26, 2025"
Postcard Pohutu Geyser Whakarewarewa Rotorua NZ,"90,809.80 VND",https://www.ebay.com/itm/146321617588,https://i.ebayimg.com/images/g/F44AAOSwGh9nGeEL/s-l140.jpg,"Sold  Jan 29, 2025"
Postcard Pohutu Geyser Rotorua NZ,"90,809.80 VND",https://www.ebay.com/itm/146344113193,https://i.ebayimg.com/images/g/Da0AAOSwbptnjzLb/s-l140.jpg,"Sold  Jan 25, 2025"
Castle Geyser Yellowstone National Park Wyoming Vtg Postcard CP347,"102,779.00 VND",https://www.ebay.com/itm/267129316821,https://i.ebayimg.com/images/g/gBEAAOSw1PJmDzHt/s-l140.jpg,"Sold  Jan 28, 2025"
Castle Geyser Yellowstone National Park Wyoming Postcard Unposted,"77,799.80 VND",https://www.ebay.com/itm/205062801863,https://i.ebayimg.com/images/g/KyAAAOSw~E5nG-O9/s-l140.jpg,"Sold  Jan 21, 2025"
Postcard Castle Geyser Yellowstone National Park Wyoming Vtg 50% Off 5+ Postcard,"111,625.80 VND",https://www.ebay.com/itm/126876517088,https://i.ebayimg.com/images/g/DsgAAOSwK59nSg0N/s-l140.jpg,"Sold  Jan 21, 2025"
Calfee & Catlin (Bozeman MT Territory): Yellowstone; Giant Geyser 1880s E085,"4,956,810.00 VND",https://www.ebay.com/itm/365347293162,https://i.ebayimg.com/images/g/zvEAAOSwM~RniVH2/s-l140.jpg,"Sold  Jan 26, 2025"
Calfee & Catlin (Bozeman MT Territory): Yellowstone; Grotto Geyser 1880s E084,"3,421,630.00 VND",https://www.ebay.com/itm/316138376991,https://i.ebayimg.com/images/g/YG0AAOSwVu9niVGU/s-l140.jpg,"Sold  Jan 26, 2025"
"Yellowstone Park WY-Wyoming, Castle Geyser, Scenic, Vintage Postcard","129,839.80 VND",https://www.ebay.com/itm/335784653383,https://i.ebayimg.com/images/g/vBUAAOSwzkBnlUxq/s-l140.jpg,"Sold  Jan 26, 2025"
"Yellowstone Park WY-Wyoming, Riverside Geyser, Vintage Postcard","32,525.00 VND",https://www.ebay.com/itm/405472150001,https://i.ebayimg.com/images/g/XEcAAOSwSmdngTxx/s-l140.jpg,"Sold  Jan 21, 2025"
"Yellowstone Park WY-Wyoming, Sponge Geyser, Vintage Postcard","32,525.00 VND",https://www.ebay.com/itm/405472149800,https://i.ebayimg.com/images/g/7pcAAOSwHdBngTw4/s-l140.jpg,"Sold  Jan 21, 2025"
VTG Yellowstone Park Embroidered Patch Sew-on Voyager Emblems Bear Geyser,"221,170.00 VND",https://www.ebay.com/itm/186644408654,https://i.ebayimg.com/images/g/I84AAOSwtrNmxTvd/s-l140.jpg,"Sold  Jan 24, 2025"
VTG Yellowstone Park Embroidered Patch Sew-on Voyager Emblems Bear Geyser,"260,200.00 VND",https://www.ebay.com/itm/325828828431,https://i.ebayimg.com/images/g/gf0AAOSw6jllFGBO/s-l140.jpg,"Sold  Jan 18, 2025"
"Old Faithful Geyser At Sunrise, Yellowstone National Park, Wyoming Postcard","91,070.00 VND",https://www.ebay.com/itm/186867465938,https://i.ebayimg.com/images/g/kr4AAOSw8DVjmSZN/s-l140.jpg,"Sold  Jan 23, 2025"
Old Faithful Geyser at Sunrise Yellowstone National Park Wyoming WY Postcard,"26,020.00 VND",https://www.ebay.com/itm/126842656292,https://i.ebayimg.com/images/g/a~YAAOSwlWJg8oDb/s-l140.jpg,"Sold  Jan 13, 2025"
Postcard WY Yellowstone National Park Giant Geyser Posted 1906 Vintage PC L3917,"19,515.00 VND",https://www.ebay.com/itm/156633281748,https://i.ebayimg.com/images/g/CJMAAOSwLwVng~24/s-l140.jpg,"Sold  Jan 19, 2025"
Postcard WY Yellowstone National Park Giant Geyser 1934 Linen Vintage PC H6229,"26,020.00 VND",https://www.ebay.com/itm/156640485693,https://i.ebayimg.com/images/g/R~sAAOSwGW5lr6nc/s-l140.jpg,"Sold  Jan 19, 2025"
RARE-YELLOWSTONE PARK-OLD FAITHFUL GEYSER-TYPE A-#131-HAYNES-(#245),"1,040,539.80 VND",https://www.ebay.com/itm/387575482867,https://i.ebayimg.com/images/g/drkAAOSwoLlnJ5EX/s-l140.jpg,"Sold  Jan 17, 2025"
RARE-YELLOWSTONE PARK-OLD FAITHFUL GEYSER AT SUNRISE-TYPE A-#132-HAYNES-(#246),"1,040,539.80 VND",https://www.ebay.com/itm/387575487968,https://i.ebayimg.com/images/g/y4AAAOSwY0tnJ5Jd/s-l140.jpg,"Sold  Jan 17, 2025"
"Yellowstone Nat'l Park, Grotto Geyser, Upper Basin, Vintage Postcard","20,555.80 VND",https://www.ebay.com/itm/405459711214,https://i.ebayimg.com/images/g/Bk0AAOSwqJ9nLFBB/s-l140.jpg,"Sold  Jan 15, 2025"
"Yellowstone Nat'l Park, Sapphire Pool, Upper Geyser Basin, Vintage Postcard","20,555.80 VND",https://www.ebay.com/itm/405459711117,https://i.ebayimg.com/images/g/1lcAAOSwx8pnLFBI/s-l140.jpg,"Sold  Jan 15, 2025"
RIVERSIDE GEYSER Yellowstone Wyoming 1913 Postcard JK9,"91,070.00 VND",https://www.ebay.com/itm/205101077310,https://i.ebayimg.com/images/g/KUwAAOSwz6RnNFzV/s-l140.jpg,"Sold  Jan 11, 2025"
BEEHIVE GEYSER Yellowstone Wyoming 1913 Postcard JK9,"77,799.80 VND",https://www.ebay.com/itm/205101087261,https://i.ebayimg.com/images/g/0yQAAOSwDX5nNF6I/s-l140.jpg,"Sold  Jan 11, 2025"
"2022-2023 Topps Chrome UEFA Womens, Geyse Ferreira Rose Gold Mojo /125, #16","64,462.50 VND",https://www.ebay.com/itm/396148573957,https://i.ebayimg.com/images/g/U1gAAOSw~z1nk8SM/s-l140.jpg,"Sold  Mar 30, 2025"
2022 Chrome UEFA Women's Champions League Sapphire Purple /15 Geyse Ferreira RC,"167,602.50 VND",https://www.ebay.com/itm/335787402134,https://i.ebayimg.com/images/g/MZQAAOSw-ERnmDGO/s-l140.jpg,"Sold  Feb 6, 2025"
2022 Topps Chrome UEFA Pink Prism Refractor 43/199 Geyse Rookie RC,"25,527.15 VND",https://www.ebay.com/itm/256784597605,https://i.ebayimg.com/images/g/YHkAAOSwVu9niFsU/s-l140.jpg,"Sold  Jan 24, 2025"
2022-23 Topps Chrome UEFA Women's GEYSE FERREIRA Gold Refractor /50 RC Barcelona,"333,915.75 VND",https://www.ebay.com/itm/156178933021,https://i.ebayimg.com/images/g/nwMAAOSwqb5mJv8H/s-l140.jpg,"Sold  Jan 21, 2025"
2022-23 TOPPS CHROME SAPPHIRE WOMENS CHAMPIONS LEAGUE GEYSE FERREIRA  #16,"25,785.00 VND",https://www.ebay.com/itm/235896076718,https://i.ebayimg.com/images/g/lswAAOSwymNndhFD/s-l140.jpg,"Sold  Jan 10, 2025"
*Harley Davidson Men's XL Slim Fit Black Geyser Riding Vented Armor Jacket New ,"3,551,209.60 VND",https://www.ebay.com/itm/176512536392,https://i.ebayimg.com/images/g/cGkAAOSwPIBmtApg/s-l500.jpg,"Sold  Apr 10, 2025"
MTG x1 MANA GEYSER 1x NM Fifth Dawn 5DN 5th #75 (Free Shipping) EDH Ritual Magic,"59,585.80 VND",https://www.ebay.com/itm/135669615165,https://i.ebayimg.com/images/g/4HsAAeSwtHhn7h1b/s-l140.jpg,"Sold  Apr 9, 2025"
"Geysers by Gallant, Roy A.","129,839.80 VND",https://www.ebay.com/itm/196891448461,https://i.ebayimg.com/images/g/kw4AAOSwcrxZcPq-/s-l140.jpg,"Sold  Mar 9, 2025"
Mtg Mana Geyser x4 - Magic the Gathering Mana Geyser Ex-Lp,"155,859.80 VND",https://www.ebay.com/itm/167422963155,https://i.ebayimg.com/images/g/nXMAAeSwT9ln7Uxh/s-l140.jpg,"Sold  Apr 9, 2025"
