Title,Price,Link,Image Link,Sold Date
Jamie Shackleton (Leeds United) hand signed 2021-2022 XL Adrenalyn Card Rare !,"99,739.34 VND",https://www.ebay.com/itm/256264754633,https://i.ebayimg.com/images/g/C~kAAOSwD-hk7JEg/s-l140.jpg,"Sold  Feb 13, 2025"
Jamie Shackleton (Leeds United) Hand Signed 2020-2021 XL Adrenalyn Card Rare !,"33,024.06 VND",https://www.ebay.com/itm/256769227564,https://i.ebayimg.com/images/g/0QcAAOSwHXBndUYI/s-l140.jpg,"Sold  Jan 11, 2025"
2020-21 Prizm Premier League #204 Jamie Shackleton RWB Prizm RC Leeds United,"38,677.50 VND",https://www.ebay.com/itm/256731564946,https://i.ebayimg.com/images/g/ZRIAAOSwIydnSI8g/s-l140.jpg,"Sold  Mar 25, 2025"
2020-21 Panini Prizm English Premier Prizms Blue #204 Jamie Shackleton /199,"51,779.80 VND",https://www.ebay.com/itm/167258908832,https://i.ebayimg.com/images/g/DRsAAeSwXcVn1Cd8/s-l140.jpg,"Sold  Mar 20, 2025"
"JAMIE SHACKLETON, LEEDS UNITED, SUPERB 6X4 PHOTO 2019/20","33,024.06 VND",https://www.ebay.com/itm/373291040083,https://i.ebayimg.com/images/g/v44AAOSwv~pef8br/s-l140.jpg,"Sold  Feb 10, 2025"
