Title,Price,Link,Image Link,Sold Date
Mathieu Valbuena LIMITED EDITION Panini Foot 2013-2014 Adrenalyn xl,"185,465.33 VND",https://www.ebay.com/itm/396338634086,https://i.ebayimg.com/images/g/MZcAAOSwhVBnAFuF/s-l140.jpg,"Sold  Mar 31, 2025"
Mathieu Valbuena LIMITED EDITION Panini Foot 2013-2014 Adrenalyn xl,"28,204.41 VND",https://www.ebay.com/itm/396116323738,https://i.ebayimg.com/images/g/MZcAAOSwhVBnAFuF/s-l140.jpg,"Sold  Feb 3, 2025"
Autograph Mathieu Valbuena (Apollon Limassol FC) France France,"185,180.44 VND",https://www.ebay.com/itm/256855987216,https://i.ebayimg.com/images/g/LoQAAOSwFeZn0xL8/s-l140.jpg,"Sold  Mar 23, 2025"
Autograph Mathieu Valbuena (Apollon Limassol FC) France France,"128,201.84 VND",https://www.ebay.com/itm/256788472860,https://i.ebayimg.com/images/g/6CgAAOSwkOhnjTcQ/s-l140.jpg,"Sold  Jan 26, 2025"
Panini Adrenalyn XL Champions League 10/11 - 191 - Mathieu Valbuena STAR PLAYER,"28,250.05 VND",https://www.ebay.com/itm/302383260078,https://i.ebayimg.com/images/g/tioAAOSw8Vtb5aAh/s-l140.jpg,"Sold  Mar 27, 2025"
Topps Champions League 2020-21 - Mathieu Valbuena (Olympiacos FC) #POF 75,"33,229.13 VND",https://www.ebay.com/itm/196895442386,https://i.ebayimg.com/images/g/OyAAAOSwxN9nXrjB/s-l140.jpg,"Sold  Jan 31, 2025"
Mathieu Valbuena Signed Photo 10x15cm Autograph France OM Marseille,"113,672.30 VND",https://www.ebay.com/itm/375506309588,https://i.ebayimg.com/images/g/KQcAAOSwtdtme-Qv/s-l140.jpg,"Sold  Apr 1, 2025"
