Title,Price,Link,Image Link,Sold Date
Nike Vapor Aeroswift Nolito Manchester City Soccer Jersey Blue Size L 847197-489,"3,902,739.80 VND",https://www.ebay.com/itm/167413430105,https://i.ebayimg.com/images/g/74wAAOSwWVlkQd9q/s-l140.jpg,"Sold  Apr 3, 2025"
Nike Vapor Aeroswift Nolito Manchester City Soccer Jersey Blue Size L 847197-489,"3,902,739.80 VND",https://www.ebay.com/itm/166376989193,https://i.ebayimg.com/images/g/74wAAOSwWVlkQd9q/s-l140.jpg,"Sold  Mar 29, 2025"
Nolito 2020-21 Panini Chronicles La Liga Elite Blue Astro #13 03/16,"128,667.15 VND",https://www.ebay.com/itm/176651498072,https://i.ebayimg.com/images/g/~1EAAOSwHHxnH4if/s-l140.jpg,"Sold  Mar 8, 2025"
2020/21 Panini Chronicles SOCCER NOLITO ELITE ASPIRATIONS BLUE /90,"25,527.15 VND",https://www.ebay.com/itm/356581125021,https://i.ebayimg.com/images/g/6dwAAOSwebVnqYav/s-l140.jpg,"Sold  Feb 23, 2025"
PANINI MOSAIC LA LIGA SOCCER 2021-22 NOLITO RC CELTA PITCH MASTERS 12/25.,"33,024.06 VND",https://www.ebay.com/itm/156607529652,https://i.ebayimg.com/images/g/gt4AAOSwTKBncDe0/s-l140.jpg,"Sold  Jan 17, 2025"
