Title,Price,Link,Image Link,Sold Date
"Hellas Mens Blue Polyester ""Theofanis Gekas"" Greece Sports Jersey Size 10","624,480.00 VND",https://www.ebay.com/itm/126930404970,https://i.ebayimg.com/images/g/mCQAAOSw4x5jPSN4/s-l140.jpg,"Sold  Feb 25, 2025"
Topps Match Attax 10/11 2010/2011 Theofanis Gekas Limited Edition LA15,"71,223.25 VND",https://www.ebay.com/itm/396265208730,https://i.ebayimg.com/images/g/ol8AAOSwea5nwdB1/s-l140.jpg,"Sold  Mar 3, 2025"
Hertha BSC autograph card Theofanis Gekas hand signed,"28,489.30 VND",https://www.ebay.com/itm/286297836178,https://i.ebayimg.com/images/g/IxAAAOSwN45nn-Bk/s-l140.jpg,"Sold  Feb 9, 2025"
"Theofanis Gekas, Greece, Bayer Leverkusen, autograph original","28,489.30 VND",https://www.ebay.com/itm/266401194904,https://i.ebayimg.com/images/g/muEAAOSwsjVk9zgU/s-l140.jpg,"Sold  Jan 24, 2025"
Panini stickers 3 Theofanis Gekas VfL Bochum football Bundesliga 2007/08,"42,164.16 VND",https://www.ebay.com/itm/316112601967,https://i.ebayimg.com/images/g/Rz4AAOSwqGpmWiPM/s-l140.jpg,"Sold  Jan 18, 2025"
