Title,Price,Link,Image Link,Sold Date
2020 Panini Immaculate Soccer Wesley Sonck - Ajax autograph 1/1,"2,475,360.00 VND",https://www.ebay.com/itm/375914630745,https://i.ebayimg.com/images/g/gRIAAOSwqxJnf7ln/s-l140.jpg,"Sold  Jan 16, 2025"
PANINI SELECT UEFA EURO 2020 WESLEY SONCK BELGIUM AUTOGRAPH 7/75.,"132,916.52 VND",https://www.ebay.com/itm/156719727023,https://i.ebayimg.com/images/g/TF4AAOSwsUFnt6wL/s-l140.jpg,"Sold  Mar 1, 2025"
"Wesley Sonck, Belgium, KRC Genk, Autograph Original","142,446.49 VND",https://www.ebay.com/itm/266753559488,https://i.ebayimg.com/images/g/Xu8AAOSw1GxmDqOP/s-l500.jpg,"Sold  Apr 4, 2025"
"2018 Panini National Treasures - Dual Sigs Kevin de Bruyne, Wesley Sonck /25","1,951,500.00 VND",https://www.ebay.com/itm/176891637534,https://i.ebayimg.com/images/g/mOgAAOSwzdxnq7hA/s-l500.jpg,"Sold  Mar 10, 2025"
"Wesley Sonck Hand Signed Autograph Card, Autograph, Ajax Amsterdam, Belgium","71,223.25 VND",https://www.ebay.com/itm/205219855384,https://i.ebayimg.com/images/g/y9oAAOSweUFng5wm/s-l140.jpg,"Sold  Jan 19, 2025"
